"DateTime","WindSpeed","U","V","RH","P","T","WS","WD","Newdate","Year","Month","Day","Hour"
"01/01/2011 01:00",10.14,3.373565674,-5.185395241,0.005022287,102321.7031,277.5469971,6.186216061,326.952,2011-01-01,2011,1,1,1
"01/01/2011 02:00",10.12,1.926433802,-5.926662445,0.004975498,102365.1875,277.4060669,6.231891762,341.993,2011-01-01,2011,1,1,2
"01/01/2011 03:00",8.94,0.62530911,-6.506192684,0.004870151,102432.4219,277.1083984,6.536172789,354.51,2011-01-01,2011,1,1,3
"01/01/2011 04:00",9.53,-0.294135571,-6.760741711,0.004641871,102493.9609,276.8328857,6.767137077,2.491,2011-01-01,2011,1,1,4
"01/01/2011 05:00",11.68,-0.551287532,-6.811029434,0.004435315,102540,276.3977356,6.833303732,4.627,2011-01-01,2011,1,1,5
"01/01/2011 06:00",10.93,-0.608632505,-6.977635384,0.004259458,102600.5,276.777832,7.00412943,4.985,2011-01-01,2011,1,1,6
"01/01/2011 07:00",11.01,-0.785324395,-7.378848076,0.004015027,102674.2188,276.9784851,7.420521096,6.075,2011-01-01,2011,1,1,7
"01/01/2011 08:00",11.56,-1.096325159,-7.811967373,0.003968935,102728.1563,276.8271484,7.88852097,7.988,2011-01-01,2011,1,1,8
"01/01/2011 09:00",10.47,-1.281582356,-7.948484898,0.003938755,102782.1484,276.6340942,8.051140634,9.159,2011-01-01,2011,1,1,9
"01/01/2011 10:00",11.18,-1.408780217,-7.712506771,0.003919742,102826,276.542511,7.840116223,10.351,2011-01-01,2011,1,1,10
"01/01/2011 11:00",10.82,-1.469549656,-7.21897459,0.003687227,102840.0625,276.3760071,7.367032668,11.506,2011-01-01,2011,1,1,11
"01/01/2011 12:00",10.91,-1.380330205,-6.706890583,0.003508118,102827.8672,276.3137207,6.847458855,11.629,2011-01-01,2011,1,1,12
"01/01/2011 13:00",11,-1.183648229,-6.457279205,0.003397485,102822.5859,276.3105469,6.564866934,10.387,2011-01-01,2011,1,1,13
"01/01/2011 14:00",11.06,-0.939645529,-6.493532181,0.003370603,102843.8672,276.2752075,6.56116559,8.233,2011-01-01,2011,1,1,14
"01/01/2011 15:00",11.95,-0.464909285,-6.663794994,0.003366571,102873.5,276.2901001,6.679992842,3.99,2011-01-01,2011,1,1,15
"01/01/2011 16:00",10.85,0.287429869,-6.769081593,0.003393131,102906.2344,276.3878784,6.775181292,357.568,2011-01-01,2011,1,1,16
"01/01/2011 17:00",11.22,1.074037671,-6.759622097,0.003435183,102931.5,276.2735596,6.844417273,350.971,2011-01-01,2011,1,1,17
"01/01/2011 18:00",10.2,1.7153759,-6.792878151,0.003538558,102968.3125,276.0762329,7.006119329,345.827,2011-01-01,2011,1,1,18
"01/01/2011 19:00",11.43,2.113955021,-6.96435976,0.003581329,102999.875,275.8507996,7.278125631,343.114,2011-01-01,2011,1,1,19
"01/01/2011 20:00",10.62,2.28423357,-7.170692444,0.003583409,103047.5234,275.6873169,7.525726086,342.33,2011-01-01,2011,1,1,20
"01/01/2011 21:00",10.26,2.100753784,-7.169258595,0.003592485,103071.8828,275.5999451,7.470705138,343.668,2011-01-01,2011,1,1,21
"01/01/2011 22:00",10.11,1.882158875,-7.091605186,0.003611755,103070.5078,275.5586243,7.337123834,345.136,2011-01-01,2011,1,1,22
"01/01/2011 23:00",9.81,1.705156326,-6.990271091,0.003631393,103073.0313,275.6221619,7.195237872,346.291,2011-01-01,2011,1,1,23
"02/01/2011 00:00",9.21,1.553633451,-6.816251755,0.00360177,103069.0469,275.6280823,6.991070368,347.159,2011-01-02,2011,1,2,0
"02/01/2011 01:00",8.7,1.462100029,-6.570469379,0.003572211,103049.7578,275.6831055,6.731181498,347.454,2011-01-02,2011,1,2,1
"02/01/2011 02:00",8.23,1.425133109,-6.31285429,0.00351969,103035.6875,275.7550964,6.471717984,347.278,2011-01-02,2011,1,2,2
"02/01/2011 03:00",8.98,1.627775908,-6.192926407,0.003517421,103023.8438,275.7935181,6.403279776,345.273,2011-01-02,2011,1,2,3
"02/01/2011 04:00",9.34,1.836853266,-6.114079475,0.003504978,103008.8672,275.8068542,6.38404243,343.278,2011-01-02,2011,1,2,4
"02/01/2011 05:00",8.57,2.098557472,-5.956353664,0.003592538,102984.4688,275.7286682,6.31522703,340.591,2011-01-02,2011,1,2,5
"02/01/2011 06:00",9.03,2.237493515,-5.85072422,0.003690663,102986.4141,275.7259521,6.263972472,339.071,2011-01-02,2011,1,2,6
"02/01/2011 07:00",10.27,2.350915432,-5.73370409,0.00372263,102990.5,275.7252197,6.196948117,337.705,2011-01-02,2011,1,2,7
"02/01/2011 08:00",8.61,2.475492001,-5.612355232,0.003741835,102995.7188,275.7670593,6.134051834,336.198,2011-01-02,2011,1,2,8
"02/01/2011 09:00",9.46,2.59537816,-5.445872307,0.003748462,103011.5625,275.8615112,6.032703621,334.518,2011-01-02,2011,1,2,9
"02/01/2011 10:00",7.55,2.615240097,-5.254910469,0.003732542,103014.1719,275.8961792,5.869715905,333.541,2011-01-02,2011,1,2,10
"02/01/2011 11:00",6.89,2.607079029,-5.002484798,0.003667229,103003.3438,275.9719849,5.641073942,332.473,2011-01-02,2011,1,2,11
"02/01/2011 12:00",8.58,2.691429138,-4.740728855,0.003533363,102972.7344,276.0508118,5.45144943,330.415,2011-01-02,2011,1,2,12
"02/01/2011 13:00",8.89,2.898655653,-4.540973663,0.003468132,102942.5938,276.1106873,5.387267063,327.448,2011-01-02,2011,1,2,13
"02/01/2011 14:00",7.32,3.145788193,-4.488743782,0.003441039,102925.8906,276.1517944,5.481314085,324.976,2011-01-02,2011,1,2,14
"02/01/2011 15:00",6.42,3.247613192,-4.718051434,0.003425258,102913.7422,276.1800232,5.727739587,325.458,2011-01-02,2011,1,2,15
"02/01/2011 16:00",6.86,3.09684515,-5.044312,0.003398058,102916.8438,276.1687317,5.919082145,328.453,2011-01-02,2011,1,2,16
"02/01/2011 17:00",7.1,2.765996933,-5.284759521,0.003374761,102924.1563,276.1227417,5.964848886,332.372,2011-01-02,2011,1,2,17
"02/01/2011 18:00",6.65,2.395894289,-5.332295895,0.003378223,102930.1797,276.1477356,5.845826627,335.804,2011-01-02,2011,1,2,18
"02/01/2011 19:00",5.92,2.160728216,-5.099254608,0.00339315,102947.7344,276.2330017,5.538153481,337.035,2011-01-02,2011,1,2,19
"02/01/2011 20:00",6.16,1.991321564,-4.661239624,0.003331809,102951.0313,276.3921509,5.068778591,336.867,2011-01-02,2011,1,2,20
"02/01/2011 21:00",5.06,2.11467886,-3.893070221,0.003197142,102907.8438,276.5814209,4.430334347,331.489,2011-01-02,2011,1,2,21
"02/01/2011 22:00",5.1,2.619289637,-2.92477107,0.003141709,102831.2656,276.6791382,3.926189503,318.153,2011-01-02,2011,1,2,22
"02/01/2011 23:00",5.13,3.298011065,-1.926063418,0.003109766,102742.8125,276.6715698,3.819240405,300.285,2011-01-02,2011,1,2,23
"03/01/2011 00:00",4.64,4.045469284,-1.149871588,0.003078602,102657.1563,276.5492554,4.205713542,285.867,2011-01-03,2011,1,3,0
"03/01/2011 01:00",4.59,4.704918385,-0.680141509,0.003067103,102582.9375,276.3338928,4.753824721,278.225,2011-01-03,2011,1,3,1
"03/01/2011 02:00",4.88,5.221641064,-0.247685432,0.003082657,102531.1719,276.0301819,5.227512168,272.715,2011-01-03,2011,1,3,2
"03/01/2011 03:00",5.63,5.609628677,0.088037789,0.00316302,102482.0313,275.600708,5.61031947,269.1,2011-01-03,2011,1,3,3
"03/01/2011 04:00",7.8,5.861374855,0.459468663,0.003304201,102428.375,274.9913635,5.879355972,265.517,2011-01-03,2011,1,3,4
"03/01/2011 05:00",8.88,6.127433777,0.836571932,0.00339956,102376.8984,274.6082459,6.184278235,262.225,2011-01-03,2011,1,3,5
"03/01/2011 06:00",9.03,6.531341553,1.304334879,0.003470155,102326.4453,274.5960693,6.660308698,258.706,2011-01-03,2011,1,3,6
"03/01/2011 07:00",7.78,6.988865852,1.748697162,0.003549194,102272.5313,274.6199036,7.204317294,255.952,2011-01-03,2011,1,3,7
"03/01/2011 08:00",6.38,7.444903374,2.190782309,0.003644089,102220.1563,274.5717773,7.760548522,253.602,2011-01-03,2011,1,3,8
"03/01/2011 09:00",8.72,7.70273304,2.724115849,0.003723996,102175.4844,274.6990051,8.170245005,250.523,2011-01-03,2011,1,3,9
"03/01/2011 10:00",9.97,7.775851727,3.413279057,0.003796417,102114.7656,275.0033569,8.492016486,246.3,2011-01-03,2011,1,3,10
"03/01/2011 11:00",9.93,8.031225204,4.192914963,0.003819383,102026.2813,275.4193115,9.059862812,242.431,2011-01-03,2011,1,3,11
"03/01/2011 12:00",11.54,8.631390572,4.944246292,0.003753908,101926.7344,275.6976318,9.947184255,240.194,2011-01-03,2011,1,3,12
"03/01/2011 13:00",11.04,9.35574913,5.557587147,0.003638709,101841.7344,275.5774231,10.88194912,239.288,2011-01-03,2011,1,3,13
"03/01/2011 14:00",10.29,9.860589027,5.904350281,0.003584704,101780.0781,275.1482239,11.4931531,239.087,2011-01-03,2011,1,3,14
"03/01/2011 15:00",11.41,9.963877678,6.108646393,0.00356898,101711.6094,274.670166,11.68736151,238.488,2011-01-03,2011,1,3,15
"03/01/2011 16:00",11.53,9.999922752,6.472893715,0.00353046,101611.5703,274.8380127,11.91204466,237.085,2011-01-03,2011,1,3,16
"03/01/2011 17:00",11.67,9.912926674,6.658022881,0.003488231,101525.25,274.7454834,11.94133091,236.112,2011-01-03,2011,1,3,17
"03/01/2011 18:00",12.13,9.960089684,6.667292118,0.003480154,101459.4531,274.6605835,11.98566522,236.201,2011-01-03,2011,1,3,18
"03/01/2011 19:00",11.95,9.88258934,6.831197262,0.003510444,101395.3594,274.5768738,12.0137766,235.346,2011-01-03,2011,1,3,19
"03/01/2011 20:00",12.72,10.13390541,7.201504231,0.003571377,101317,274.7200012,12.4321238,234.601,2011-01-03,2011,1,3,20
"03/01/2011 21:00",10.97,10.27598953,7.534548759,0.003620753,101240.125,274.8822021,12.74226769,233.75,2011-01-03,2011,1,3,21
"03/01/2011 22:00",NA,10.35656738,7.599070549,0.003696741,101142.6719,274.8492126,12.84540234,233.73,2011-01-03,2011,1,3,22
"03/01/2011 23:00",NA,10.52963638,7.273994446,0.003791787,101035.1094,274.8430481,12.79782159,235.362,2011-01-03,2011,1,3,23
"04/01/2011 00:00",NA,10.63950825,6.748435497,0.00389046,100920.7188,275.0538025,12.59922686,237.613,2011-01-04,2011,1,4,0
"04/01/2011 01:00",NA,10.52843475,6.054009438,0.004008231,100812.3438,275.4627991,12.14491534,240.1,2011-01-04,2011,1,4,1
"04/01/2011 02:00",NA,10.27551746,5.422907352,0.00413745,100718.7969,275.7400208,11.61869973,242.177,2011-01-04,2011,1,4,2
"04/01/2011 03:00",NA,10.03878784,4.931615353,0.004282206,100620.4609,275.9928894,11.1847258,243.837,2011-01-04,2011,1,4,3
"04/01/2011 04:00",8.95,9.93957901,4.558573723,0.004503387,100537.9688,276.2440796,10.93507317,245.362,2011-01-04,2011,1,4,4
"04/01/2011 05:00",9.78,9.865190506,4.431420803,0.004701667,100461.8594,276.479126,10.81478035,245.81,2011-01-04,2011,1,4,5
"04/01/2011 06:00",8.36,9.591884613,4.737263203,0.004755002,100388.9688,276.587677,10.69793967,243.716,2011-01-04,2011,1,4,6
"04/01/2011 07:00",6.83,9.175560951,5.486841679,0.004747337,100328.5,276.5550232,10.69094712,239.121,2011-01-04,2011,1,4,7
"04/01/2011 08:00",11.52,8.863423347,6.480264664,0.004755001,100283.4375,276.6503296,10.97971327,233.828,2011-01-04,2011,1,4,8
"04/01/2011 09:00",10.95,8.859733582,7.296864986,0.004770176,100218.6719,276.7987671,11.47776624,230.525,2011-01-04,2011,1,4,9
"04/01/2011 10:00",9.59,8.841237068,7.920434475,0.004747154,100137.3281,276.8783875,11.87016239,228.144,2011-01-04,2011,1,4,10
"04/01/2011 11:00",10.6,8.79918766,8.509478569,0.004701476,100060.7813,277.0103455,12.24078956,225.958,2011-01-04,2011,1,4,11
"04/01/2011 12:00",11.78,8.705411911,8.996596336,0.004687007,99969.5,277.1158142,12.51890339,224.057,2011-01-04,2011,1,4,12
"04/01/2011 13:00",12.42,8.62978363,9.313751221,0.00468089,99878.48438,277.1978149,12.69720943,222.817,2011-01-04,2011,1,4,13
"04/01/2011 14:00",13.67,8.427276611,9.504747391,0.00466438,99795.25,277.1951904,12.70272467,221.561,2011-01-04,2011,1,4,14
"04/01/2011 15:00",12.68,7.917008877,9.944737434,0.004633103,99708.70313,277.0242615,12.71128759,218.523,2011-01-04,2011,1,4,15
"04/01/2011 16:00",11.19,7.190093994,10.64210892,0.004625207,99614.03125,276.9611206,12.84336147,214.044,2011-01-04,2011,1,4,16
"04/01/2011 17:00",11.75,6.824780464,11.35298729,0.004617345,99525.10938,277.0100403,13.24643155,211.011,2011-01-04,2011,1,4,17
"04/01/2011 18:00",11.01,7.189963818,11.46891212,0.004609631,99461.54688,276.9256897,13.53630396,212.083,2011-01-04,2011,1,4,18
"04/01/2011 19:00",11.85,7.721766472,10.72896194,0.004564338,99412.70313,276.7044067,13.21878594,215.743,2011-01-04,2011,1,4,19
"04/01/2011 20:00",12.32,7.695426464,9.531317711,0.004542166,99376.15625,276.4955444,12.25012677,218.916,2011-01-04,2011,1,4,20
"04/01/2011 21:00",13.13,7.068654537,8.633300781,0.004511974,99361.35938,276.3692627,11.15794602,219.309,2011-01-04,2011,1,4,21
"04/01/2011 22:00",12.97,6.507286072,8.20165062,0.004481821,99353.17188,276.3348999,10.46956756,218.428,2011-01-04,2011,1,4,22
"04/01/2011 23:00",11.57,6.129733086,7.885928154,0.00451229,99331.73438,276.3314819,9.988067408,217.857,2011-01-04,2011,1,4,23
"05/01/2011 00:00",10.44,6.154738426,7.591699123,0.004565737,99308.83594,276.3540649,9.773162266,219.032,2011-01-05,2011,1,5,0
"05/01/2011 01:00",9.19,6.402610302,7.297327042,0.004581055,99325.28125,276.3210754,9.707955533,221.263,2011-01-05,2011,1,5,1
"05/01/2011 02:00",8.65,6.507281303,7.069380283,0.004558455,99346.51563,276.2362976,9.608373825,222.629,2011-01-05,2011,1,5,2
"05/01/2011 03:00",8.02,6.702144623,6.707182884,0.004505856,99317.03125,276.0183105,9.481827081,224.978,2011-01-05,2011,1,5,3
"05/01/2011 04:00",9.92,6.802469254,6.427994728,0.004430281,99278.5,275.8280029,9.359097401,226.621,2011-01-05,2011,1,5,4
"05/01/2011 05:00",8.55,6.570152283,6.356290817,0.004361211,99250.5,275.7052612,9.14162644,225.947,2011-01-05,2011,1,5,5
"05/01/2011 06:00",6.47,6.06266737,6.463344097,0.004307548,99234.09375,275.564209,8.861757871,223.167,2011-01-05,2011,1,5,6
"05/01/2011 07:00",6.19,5.417381287,6.779130936,0.004253894,99220.375,275.3541565,8.677824396,218.629,2011-01-05,2011,1,5,7
"05/01/2011 08:00",8.99,4.719979286,7.225302219,0.004208004,99199.32813,275.1782532,8.630364802,213.154,2011-01-05,2011,1,5,8
"05/01/2011 09:00",9.05,3.889620066,7.691164017,0.004177531,99170.90625,275.2592773,8.618767208,206.826,2011-01-05,2011,1,5,9
"05/01/2011 10:00",8.49,3.220092297,8.086933136,0.00419288,99108.53125,275.5690308,8.704451846,201.711,2011-01-05,2011,1,5,10
"05/01/2011 11:00",7.56,2.710782528,8.36372757,0.004238667,99054,276.0022583,8.792057824,197.958,2011-01-05,2011,1,5,11
"05/01/2011 12:00",7.65,2.377334595,8.534368515,0.004269163,98989.49219,276.4806519,8.859298264,195.565,2011-01-05,2011,1,5,12
"05/01/2011 13:00",9.52,2.15375042,8.540180206,0.004284398,98898.59375,276.7554932,8.807571676,194.154,2011-01-05,2011,1,5,13
"05/01/2011 14:00",10.68,1.865536571,8.446042061,0.00430732,98803.28125,276.7760925,8.649615783,192.455,2011-01-05,2011,1,5,14
"05/01/2011 15:00",9.95,1.765500426,8.217483521,0.004360176,98735.35938,276.7121277,8.405000129,192.125,2011-01-05,2011,1,5,15
"05/01/2011 16:00",9.59,2.318605423,7.555788994,0.004435576,98683.34375,276.6391296,7.903535818,197.059,2011-01-05,2011,1,5,16
"05/01/2011 17:00",7.41,3.596723795,6.135708332,0.004518868,98654.04688,276.4788513,7.112196482,210.378,2011-01-05,2011,1,5,17
"05/01/2011 18:00",5.09,5.070168972,3.961186409,0.004602421,98647.21875,276.3096008,6.434097541,232,2011-01-05,2011,1,5,18
"05/01/2011 19:00",5.24,6.213941097,1.402377725,0.00465572,98674.625,276.1538391,6.370221915,257.282,2011-01-05,2011,1,5,19
"05/01/2011 20:00",7.16,6.811487675,-0.751147985,0.004571866,98710.1875,275.6769104,6.852779556,276.292,2011-01-05,2011,1,5,20
"05/01/2011 21:00",7.94,7.259546757,-1.383629441,0.00429731,98754.34375,274.8132324,7.390226623,280.79,2011-01-05,2011,1,5,21
"05/01/2011 22:00",9.42,7.754043579,-0.484112769,0.004022743,98801.49219,273.8753052,7.76914133,273.572,2011-01-05,2011,1,5,22
"05/01/2011 23:00",9.87,8.594711304,1.012263417,0.003939146,98793,273.6382751,8.654116917,263.282,2011-01-05,2011,1,5,23
"06/01/2011 00:00",10.78,9.69178009,1.965543747,0.004023817,98772.25,274.0172119,9.889083049,258.535,2011-01-06,2011,1,6,0
"06/01/2011 01:00",11.82,10.2197237,0.97982794,0.004276978,98740.05469,274.8900146,10.26658733,264.523,2011-01-06,2011,1,6,1
"06/01/2011 02:00",11.19,9.777768135,-2.191977978,0.004619553,98782.8125,276.1923218,10.02045494,282.635,2011-01-06,2011,1,6,2
"06/01/2011 03:00",11.23,7.869454861,-5.235340118,0.004596915,98874.22656,276.5936279,9.451830826,303.634,2011-01-06,2011,1,6,3
"06/01/2011 04:00",11.77,5.787399769,-6.786095142,0.004368073,98975.6875,276.4095154,8.918805041,319.541,2011-01-06,2011,1,6,4
"06/01/2011 05:00",10.63,4.185556412,-6.800199509,0.004237728,99072.5625,276.3078613,7.985085838,328.387,2011-01-06,2011,1,6,5
"06/01/2011 06:00",9.42,3.483739376,-6.337279797,0.004176415,99163.5,276.3622437,7.231704865,331.201,2011-01-06,2011,1,6,6
"06/01/2011 07:00",8.01,3.413829565,-6.314722538,0.004046701,99254.28125,276.1362,7.17843667,331.603,2011-01-06,2011,1,6,7
"06/01/2011 08:00",10.05,3.475852251,-6.306152344,0.003859961,99321.04688,275.8641663,7.200632351,331.137,2011-01-06,2011,1,6,8
"06/01/2011 09:00",9.91,3.726212025,-6.010685444,0.003551675,99360.34375,275.5933228,7.071986677,328.203,2011-01-06,2011,1,6,9
"06/01/2011 10:00",8.89,4.230558872,-5.445457935,0.003289428,99419.3125,275.1802979,6.895697245,322.156,2011-01-06,2011,1,6,10
"06/01/2011 11:00",8.39,4.827736378,-4.818333626,0.003114373,99475.35938,274.7270203,6.820804752,314.944,2011-01-06,2011,1,6,11
"06/01/2011 12:00",8.76,5.307170391,-4.415447235,0.003025926,99501.3125,274.4122009,6.903783879,309.759,2011-01-06,2011,1,6,12
"06/01/2011 13:00",9.01,5.601117611,-4.154013157,0.003001575,99516.6875,274.3276672,6.973402598,306.562,2011-01-06,2011,1,6,13
"06/01/2011 14:00",8.65,5.748836994,-3.760528088,0.002947011,99545.75,274.36203,6.869548623,303.19,2011-01-06,2011,1,6,14
"06/01/2011 15:00",7.42,6.103108883,-3.18978858,0.002931541,99600.14063,274.3435059,6.886413379,297.593,2011-01-06,2011,1,6,15
"06/01/2011 16:00",6.31,6.29666853,-2.871337891,0.002954778,99650.95313,274.3034363,6.920449108,294.513,2011-01-06,2011,1,6,16
"06/01/2011 17:00",6.15,6.24354744,-2.85960412,0.002985765,99700.71875,274.1646423,6.86725712,294.608,2011-01-06,2011,1,6,17
"06/01/2011 18:00",6.36,6.057761669,-2.822442293,0.003043361,99769.82813,274.0688782,6.683012565,294.981,2011-01-06,2011,1,6,18
"06/01/2011 19:00",5.72,5.794659615,-2.56059289,0.003108416,99849.73438,274.0545654,6.335196603,293.84,2011-01-06,2011,1,6,19
"06/01/2011 20:00",6.46,5.497609615,-1.9386096,0.003184747,99931.75,274.1164246,5.829401227,289.424,2011-01-06,2011,1,6,20
"06/01/2011 21:00",6.43,5.593375206,-1.132483006,0.003211177,99988.03906,274.0825195,5.706869891,281.445,2011-01-06,2011,1,6,21
"06/01/2011 22:00",6.61,6.00333786,-0.347284675,0.003195498,100022.7969,273.8686829,6.013374436,273.31,2011-01-06,2011,1,6,22
"06/01/2011 23:00",4.88,6.422246933,0.286178589,0.00319514,100079.4219,273.5852051,6.428619903,267.448,2011-01-06,2011,1,6,23
"07/01/2011 00:00",2.68,6.655130863,0.698865294,0.003190954,100150.625,273.3785706,6.691724703,264.005,2011-01-07,2011,1,7,0
"07/01/2011 01:00",3.47,6.392450333,0.988954544,0.003229036,100206.8516,273.2507324,6.468496915,261.205,2011-01-07,2011,1,7,1
"07/01/2011 02:00",4.29,5.887614727,1.32113421,0.00326311,100229.5156,273.2947693,6.034020449,257.352,2011-01-07,2011,1,7,2
"07/01/2011 03:00",4.24,5.187955856,1.795422316,0.003289469,100242.1094,273.4523926,5.489847653,250.91,2011-01-07,2011,1,7,3
"07/01/2011 04:00",4.12,4.531602383,2.395828247,0.003289104,100266.3672,273.6135254,5.125954852,242.134,2011-01-07,2011,1,7,4
"07/01/2011 05:00",NA,4.023278236,3.027472973,0.003250723,100279.0391,273.6838379,5.035112746,233.038,2011-01-07,2011,1,7,5
"07/01/2011 06:00",NA,3.604462862,3.653978348,0.003185682,100291.9375,273.678833,5.132612423,224.609,2011-01-07,2011,1,7,6
"07/01/2011 07:00",5.86,3.228450298,4.081429005,0.003124485,100315.1094,273.6730957,5.203936399,218.344,2011-01-07,2011,1,7,7
"07/01/2011 08:00",6.21,2.806757689,4.185311317,0.003082424,100335.6719,273.74646,5.039317369,213.846,2011-01-07,2011,1,7,8
"07/01/2011 09:00",5.99,2.136657238,3.849794388,0.003059165,100326.5,273.9266968,4.402978649,209.03,2011-01-07,2011,1,7,9
"07/01/2011 10:00",7.2,1.077300549,3.501140594,0.002944108,100279.4844,273.8661499,3.663135533,197.103,2011-01-07,2011,1,7,10
"07/01/2011 11:00",8.03,-0.140593112,3.358821154,0.002771597,100203.0625,273.7044983,3.36176233,177.603,2011-01-07,2011,1,7,11
"07/01/2011 12:00",8.3,-1.239531875,3.360955954,0.002690694,100102.3438,273.729187,3.582242899,159.755,2011-01-07,2011,1,7,12
"07/01/2011 13:00",6.42,-2.259078264,3.611393452,0.002697004,100005.3125,274.0214844,4.259764931,147.972,2011-01-07,2011,1,7,13
"07/01/2011 14:00",4.07,-3.371935368,3.952760696,0.002703419,99924.32813,274.5657959,5.195600566,139.533,2011-01-07,2011,1,7,14
"07/01/2011 15:00",5.57,-4.29284811,4.090375423,0.002870871,99855.57813,275.1090393,5.929562885,133.616,2011-01-07,2011,1,7,15
"07/01/2011 16:00",5.85,-4.948138714,4.053896904,0.003179871,99784.1875,275.5705261,6.396730168,129.326,2011-01-07,2011,1,7,16
"07/01/2011 17:00",5.72,-5.288028717,3.734569311,0.003576679,99708.84375,275.8437195,6.473813069,125.23,2011-01-07,2011,1,7,17
"07/01/2011 18:00",5.93,-5.454938412,2.969591856,0.0039125,99644.85156,275.9837646,6.210863778,118.563,2011-01-07,2011,1,7,18
"07/01/2011 19:00",6.8,-5.556798458,1.952440619,0.004137725,99565.90625,275.9483032,5.889824571,109.359,2011-01-07,2011,1,7,19
"07/01/2011 20:00",8.38,-5.353680611,0.674050331,0.004275243,99479.95313,275.3399658,5.39594662,97.176,2011-01-07,2011,1,7,20
"07/01/2011 21:00",8.61,-5.273966312,-0.395555973,0.004328527,99381.60938,274.9556274,5.288779178,85.71,2011-01-07,2011,1,7,21
"07/01/2011 22:00",8.78,-5.268856525,-1.11783886,0.004358384,99263.57813,275.0327759,5.386131525,78.021,2011-01-07,2011,1,7,22
"07/01/2011 23:00",8.25,-5.076261044,-1.578836083,0.004395992,99144.07813,275.1496277,5.316121665,72.723,2011-01-07,2011,1,7,23
"08/01/2011 00:00",5.73,-4.520266056,-2.094853401,0.004441379,99029.95313,275.2784119,4.98208952,65.135,2011-01-08,2011,1,8,0
"08/01/2011 01:00",2.26,-3.57322669,-2.721933126,0.004479139,98928.95313,275.522644,4.491866975,52.701,2011-01-08,2011,1,8,1
"08/01/2011 02:00",1.79,-2.222432137,-3.548867226,0.004417799,98863.4375,275.374054,4.18732172,32.056,2011-01-08,2011,1,8,2
"08/01/2011 03:00",4.34,-0.425049037,-4.581702232,0.004356906,98801.60938,275.1013794,4.601376102,5.3,2011-01-08,2011,1,8,3
"08/01/2011 04:00",4.87,1.469522595,-5.670755386,0.004311488,98757.21875,274.8339844,5.858068223,345.471,2011-01-08,2011,1,8,4
"08/01/2011 05:00",7.33,3.190811396,-6.323336601,0.004304295,98759.95313,274.8195801,7.082786396,333.224,2011-01-08,2011,1,8,5
"08/01/2011 06:00",7.82,4.439391613,-6.132845402,0.004266469,98773.39063,275.15448,7.570996673,324.1,2011-01-08,2011,1,8,6
"08/01/2011 07:00",7.45,5.414676666,-4.986506462,0.004167459,98797.6875,275.1238098,7.360976165,312.642,2011-01-08,2011,1,8,7
"08/01/2011 08:00",6.98,6.253750801,-3.660792828,0.003915865,98835.71875,274.506012,7.246433827,300.343,2011-01-08,2011,1,8,8
"08/01/2011 09:00",7.79,6.906171322,-2.324332237,0.003522784,98892.89063,273.3070068,7.286818419,288.601,2011-01-08,2011,1,8,9
"08/01/2011 10:00",9.02,7.53787899,-1.323311329,0.003331758,98967.26563,272.8478699,7.653154418,279.957,2011-01-08,2011,1,8,10
"08/01/2011 11:00",9.92,8.099499702,-0.579978704,0.003457319,99016.10938,273.4057312,8.120238342,274.095,2011-01-08,2011,1,8,11
"08/01/2011 12:00",12.72,8.84847641,0.229127645,0.00369346,99069.14844,274.3780518,8.851442496,268.516,2011-01-08,2011,1,8,12
"08/01/2011 13:00",12.09,9.456640244,1.065639853,0.003822854,99124.40625,275.1855774,9.516492683,263.57,2011-01-08,2011,1,8,13
"08/01/2011 14:00",13.35,9.402254105,1.999867082,0.00371211,99159.64063,275.460022,9.612588132,257.992,2011-01-08,2011,1,8,14
"08/01/2011 15:00",9.32,8.758072853,3.337162972,0.003555889,99185.27344,275.1594849,9.372326115,249.141,2011-01-08,2011,1,8,15
"08/01/2011 16:00",7.39,7.793222427,5.012033939,0.003513789,99178.28125,274.863678,9.26578653,237.253,2011-01-08,2011,1,8,16
"08/01/2011 17:00",6.83,6.886245251,6.536713123,0.003532785,99153.07031,274.7541504,9.494682307,226.491,2011-01-08,2011,1,8,17
"08/01/2011 18:00",7.15,6.617006302,7.135373592,0.003723411,99107.01563,274.870575,9.731306629,222.841,2011-01-08,2011,1,8,18
"08/01/2011 19:00",8.91,6.723056793,6.685900688,0.004097049,99079.71094,275.2346191,9.481601165,225.158,2011-01-08,2011,1,8,19
"08/01/2011 20:00",7.45,6.884266853,5.882650375,0.004341083,99059.20313,275.5220337,9.055313664,229.485,2011-01-08,2011,1,8,20
"08/01/2011 21:00",7.61,6.582155228,5.348769665,0.004394564,99045.1875,275.5574951,8.481397548,230.902,2011-01-08,2011,1,8,21
"08/01/2011 22:00",10.59,6.2218256,4.796015739,0.004402661,99034.26563,275.4301758,7.855754627,232.373,2011-01-08,2011,1,8,22
"08/01/2011 23:00",9.68,6.434438229,3.566002131,0.00441053,99039.96875,275.4107361,7.356518641,241.004,2011-01-08,2011,1,8,23
"09/01/2011 00:00",9.17,7.385705948,1.508226156,0.004418265,99087.60156,275.463623,7.538129641,258.458,2011-01-09,2011,1,9,0
"09/01/2011 01:00",9.97,8.476660728,-0.15391171,0.004265946,99169.85938,275.2712708,8.47805791,271.04,2011-01-09,2011,1,9,1
"09/01/2011 02:00",12.06,9.36528492,-0.139799654,0.00397622,99262.64844,275.0108643,9.366328287,270.855,2011-01-09,2011,1,9,2
"09/01/2011 03:00",10.96,10.17678261,0.703396738,0.003877239,99332.42969,274.8274231,10.20106226,266.046,2011-01-09,2011,1,9,3
"09/01/2011 04:00",10.54,10.70401573,1.118158817,0.003938514,99390.45313,274.8656616,10.76225961,264.036,2011-01-09,2011,1,9,4
"09/01/2011 05:00",9.53,10.84126568,0.656923294,0.004076141,99453.65625,275.1049194,10.86115048,266.532,2011-01-09,2011,1,9,5
"09/01/2011 06:00",9.66,10.80824852,-0.860179305,0.004190956,99546.30469,275.435791,10.84242337,274.55,2011-01-09,2011,1,9,6
"09/01/2011 07:00",8.09,10.30414391,-2.517469883,0.0042372,99698.33594,275.62854,10.60721623,283.729,2011-01-09,2011,1,9,7
"09/01/2011 08:00",11.3,9.753310204,-3.189445019,0.00422193,99881.6875,275.6452637,10.26156028,288.108,2011-01-09,2011,1,9,8
"09/01/2011 09:00",10.82,9.338773727,-3.112360001,0.004214248,100055.1094,275.7638245,9.843753324,288.431,2011-01-09,2011,1,9,9
"09/01/2011 10:00",10.97,8.821989059,-2.623681784,0.004214223,100189.0313,275.9489441,9.203868592,286.562,2011-01-09,2011,1,9,10
"09/01/2011 11:00",12.68,8.373306274,-1.754485607,0.004237132,100279.1016,276.145874,8.555143348,281.834,2011-01-09,2011,1,9,11
"09/01/2011 12:00",11.12,8.269464493,-0.695967138,0.00426769,100358.7656,276.3442993,8.298699492,274.81,2011-01-09,2011,1,9,12
"09/01/2011 13:00",8.69,8.45443058,0.129047841,0.004290623,100451.6406,276.4816589,8.455415411,269.125,2011-01-09,2011,1,9,13
"09/01/2011 14:00",9.22,8.426592827,0.577731311,0.004305938,100556.5469,276.4907532,8.446374378,266.077,2011-01-09,2011,1,9,14
"09/01/2011 15:00",8.44,8.15231514,1.094701529,0.004336515,100646.75,276.407074,8.225485613,262.352,2011-01-09,2011,1,9,15
"09/01/2011 16:00",8.06,7.887309551,1.806556225,0.00436706,100735.5938,276.3694458,8.091557165,257.099,2011-01-09,2011,1,9,16
"09/01/2011 17:00",9.05,7.54020977,2.519433498,0.004367032,100798.6563,276.1557312,7.949987958,251.523,2011-01-09,2011,1,9,17
"09/01/2011 18:00",9.86,7.154355049,3.380738974,0.004351729,100849.6875,275.8972168,7.912913002,244.707,2011-01-09,2011,1,9,18
"09/01/2011 19:00",9.57,6.736600399,4.450808048,0.004313499,100890.4219,275.6635132,8.074123929,236.547,2011-01-09,2011,1,9,19
"09/01/2011 20:00",7.52,6.15719986,5.610571384,0.004275234,100917.3594,275.4951477,8.330043299,227.659,2011-01-09,2011,1,9,20
"09/01/2011 21:00",7.91,5.718343258,6.747998714,0.004206206,100917.875,275.4089966,8.845051513,220.278,2011-01-09,2011,1,9,21
"09/01/2011 22:00",8.23,5.603514194,7.759225845,0.004160002,100897.2344,275.3933716,9.571047855,215.835,2011-01-09,2011,1,9,22
"09/01/2011 23:00",9.56,5.829084873,8.569115639,0.004173649,100862.7656,275.6442261,10.3637818,214.225,2011-01-09,2011,1,9,23
"10/01/2011 00:00",11.53,6.16878891,9.240805626,0.004217259,100819.6719,276.1577759,11.11064558,213.725,2011-01-10,2011,1,10,0
"10/01/2011 01:00",12.55,6.470579624,9.797950745,0.004253727,100763.8984,276.679657,11.74173068,213.44,2011-01-10,2011,1,10,1
"10/01/2011 02:00",12.43,6.675115585,10.16609669,0.004260196,100711.5156,277.0587769,12.16168944,213.289,2011-01-10,2011,1,10,2
"10/01/2011 03:00",12.63,6.575349331,10.26103783,0.004286684,100661.2031,277.1764526,12.18704706,212.652,2011-01-10,2011,1,10,3
"10/01/2011 04:00",12.84,6.298079491,10.12401676,0.004335084,100616.4063,277.1991272,11.92315062,211.885,2011-01-10,2011,1,10,4
"10/01/2011 05:00",13.65,5.991303444,9.862791061,0.004395769,100565.2344,277.1897583,11.53994647,211.277,2011-01-10,2011,1,10,5
"10/01/2011 06:00",13.87,5.521430969,9.549042702,0.00447176,100524.8281,277.1951599,11.03043138,210.037,2011-01-10,2011,1,10,6
"10/01/2011 07:00",12.17,4.8338871,9.14401722,0.00452524,100500.6094,277.144104,10.34309023,207.862,2011-01-10,2011,1,10,7
"10/01/2011 08:00",9.12,3.897333145,8.488213539,0.004533113,100483.0703,276.986908,9.340180658,204.662,2011-01-10,2011,1,10,8
"10/01/2011 09:00",7.6,2.558247089,7.659808159,0.004480219,100457.375,276.7087402,8.075722209,198.468,2011-01-10,2011,1,10,9
"10/01/2011 10:00",8.49,1.303364873,6.984270573,0.004389298,100390.6094,276.4281006,7.104843096,190.57,2011-01-10,2011,1,10,10
"10/01/2011 11:00",8.58,0.783254802,6.497292519,0.004305968,100301.8984,276.2896729,6.544333286,186.873,2011-01-10,2011,1,10,11
"10/01/2011 12:00",7.16,0.753795922,6.01145649,0.0042757,100211.0703,276.2232056,6.058532613,187.147,2011-01-10,2011,1,10,12
"10/01/2011 13:00",6.72,1.099048018,5.647264957,0.004390288,100120.4922,276.3627014,5.753217191,191.013,2011-01-10,2011,1,10,13
"10/01/2011 14:00",6.38,1.52645278,5.48576498,0.00464998,100048.5703,277.0625,5.69417909,195.549,2011-01-10,2011,1,10,14
"10/01/2011 15:00",6.42,1.734789133,5.36392498,0.00499403,99985.71875,277.8943787,5.637480335,197.922,2011-01-10,2011,1,10,15
"10/01/2011 16:00",5.76,1.335538149,5.144713879,0.005200639,99957.45313,278.3022766,5.315236875,194.552,2011-01-10,2011,1,10,16
"10/01/2011 17:00",5.95,0.49290812,4.819872856,0.005270135,99939.92188,278.4129639,4.845011121,185.839,2011-01-10,2011,1,10,17
"10/01/2011 18:00",6.62,-0.556641161,4.389530182,0.005300961,99914.35156,278.3556213,4.424683559,172.772,2011-01-10,2011,1,10,18
"10/01/2011 19:00",6.93,-1.791717172,3.707580566,0.005285346,99870.60938,278.2002563,4.11781545,154.207,2011-01-10,2011,1,10,19
"10/01/2011 20:00",7.45,-3.035964966,2.686739445,0.005208608,99817.04688,277.9888611,4.054090788,131.507,2011-01-10,2011,1,10,20
"10/01/2011 21:00",7.5,-3.957313061,1.553946614,0.005116631,99758.85938,277.8512878,4.251479359,111.438,2011-01-10,2011,1,10,21
"10/01/2011 22:00",6.29,-4.425749779,0.659362555,0.005032522,99711.76563,277.5047607,4.474597198,98.473,2011-01-10,2011,1,10,22
"10/01/2011 23:00",5.81,-4.537569046,-0.415575027,0.004978964,99646,277.2543945,4.556559607,84.767,2011-01-10,2011,1,10,23
"11/01/2011 00:00",4.1,-4.227181435,-1.960058093,0.004886574,99584.35156,276.9623413,4.659494673,65.123,2011-01-11,2011,1,11,0
"11/01/2011 01:00",NA,-3.638026714,-3.901306152,0.004816697,99569.89063,276.7285461,5.334362949,42.999,2011-01-11,2011,1,11,1
"11/01/2011 02:00",NA,-2.895629406,-6.038241863,0.004853993,99588.90625,276.7637939,6.696643522,25.619,2011-01-11,2011,1,11,2
"11/01/2011 03:00",6.47,-1.737076521,-8.219499588,0.004891939,99639.03125,276.8637085,8.401048049,11.933,2011-01-11,2011,1,11,3
"11/01/2011 04:00",11.71,-0.477201939,-10.23016357,0.00486906,99728.45313,276.8553772,10.24128744,2.67,2011-01-11,2011,1,11,4
"11/01/2011 05:00",13.78,0.547039747,-11.31641579,0.004800497,99852.9375,276.8152466,11.32963012,357.232,2011-01-11,2011,1,11,5
"11/01/2011 06:00",14.41,1.578509331,-11.21062851,0.004633142,99983.88281,276.9602356,11.32121386,351.985,2011-01-11,2011,1,11,6
"11/01/2011 07:00",15.6,2.154061794,-10.83753872,0.004519582,100108.6016,277.1466064,11.04953518,348.758,2011-01-11,2011,1,11,7
"11/01/2011 08:00",14.95,2.521852493,-10.36245823,0.004412345,100249.2656,277.1053467,10.66490884,346.322,2011-01-11,2011,1,11,8
"11/01/2011 09:00",14.62,2.884682655,-9.53514576,0.004350861,100449.1563,277.0486145,9.961947534,343.167,2011-01-11,2011,1,11,9
"11/01/2011 10:00",15.45,2.671635389,-8.636214256,0.004312378,100589.3984,277.0923462,9.04001285,342.81,2011-01-11,2011,1,11,10
"11/01/2011 11:00",14.62,2.41762495,-7.673441887,0.004258848,100664.6563,277.1323242,8.045285625,342.512,2011-01-11,2011,1,11,11
"11/01/2011 12:00",11.65,2.266105652,-6.679176807,0.004190299,100737.8594,277.0744019,7.053129635,341.258,2011-01-11,2011,1,11,12
"11/01/2011 13:00",9.25,2.295250893,-5.525838852,0.004091504,100811.3359,276.9639282,5.983566802,337.443,2011-01-11,2011,1,11,13
"11/01/2011 14:00",8.28,2.647688627,-4.45687151,0.003984438,100905.2656,276.9714355,5.184009907,329.286,2011-01-11,2011,1,11,14
"11/01/2011 15:00",8.79,3.285617113,-3.767643929,0.003854654,100995.5781,277.1006165,4.999041967,318.909,2011-01-11,2011,1,11,15
"11/01/2011 16:00",7.79,3.588251352,-3.183812618,0.003747932,101071.0469,277.2090149,4.797104393,311.582,2011-01-11,2011,1,11,16
"11/01/2011 17:00",8.08,3.165275574,-2.793678045,0.003694749,101107.7266,277.2495117,4.221801331,311.431,2011-01-11,2011,1,11,17
"11/01/2011 18:00",6.13,2.958311081,-2.436705112,0.00365692,101150.7969,277.2277527,3.832640898,309.477,2011-01-11,2011,1,11,18
"11/01/2011 19:00",3.81,2.561532021,-1.818726778,0.00363064,101145.2188,277.2506714,3.141530421,305.375,2011-01-11,2011,1,11,19
"11/01/2011 20:00",2.06,2.178243637,-0.97889328,0.003604505,101149.6875,277.3183289,2.388090743,294.198,2011-01-11,2011,1,11,20
"11/01/2011 21:00",3.37,1.622748375,0.721161723,0.003551658,101144.8594,277.3928528,1.775777722,246.039,2011-01-11,2011,1,11,21
"11/01/2011 22:00",5.72,0.479415417,2.758761883,0.003471446,101090.5156,277.3294678,2.80010826,189.858,2011-01-11,2011,1,11,22
"11/01/2011 23:00",7.76,-0.844052076,4.627334118,0.003372873,100970.125,276.8542175,4.703684189,169.662,2011-01-11,2011,1,11,23
"12/01/2011 00:00",8.52,-1.786605835,6.079345703,0.003403463,100831.5938,276.1538086,6.336434691,163.622,2011-01-12,2011,1,12,0
"12/01/2011 01:00",7.61,-1.913386106,6.949539185,0.003491409,100744.0313,275.6362305,7.20813022,164.606,2011-01-12,2011,1,12,1
"12/01/2011 02:00",7.41,-1.7064147,7.110735893,0.003606269,100712.375,275.3498535,7.312620329,166.505,2011-01-12,2011,1,12,2
"12/01/2011 03:00",8.48,-2.797651291,7.386436462,0.003717371,100596.5625,275.0527649,7.898499627,159.255,2011-01-12,2011,1,12,3
"12/01/2011 04:00",8.41,-3.617441177,7.876558304,0.003851167,100423.7656,274.9073181,8.667528563,155.332,2011-01-12,2011,1,12,4
"12/01/2011 05:00",10.7,-3.415819883,8.080051422,0.003965799,100297.5781,274.9495239,8.772403118,157.083,2011-01-12,2011,1,12,5
"12/01/2011 06:00",12.25,-2.38320446,8.007555962,0.00404255,100244.8594,274.9750671,8.354676294,163.425,2011-01-12,2011,1,12,6
"12/01/2011 07:00",11.07,-1.007867336,7.806918621,0.004081035,100180.6953,275.2857361,7.871707243,172.643,2011-01-12,2011,1,12,7
"12/01/2011 08:00",9.99,0.906893909,6.909938335,0.004164544,100144.5156,275.5091553,6.969196823,187.477,2011-01-12,2011,1,12,8
"12/01/2011 09:00",8.4,3.293667793,5.619836807,0.004309264,100097.5391,275.8747864,6.513893864,210.373,2011-01-12,2011,1,12,9
"12/01/2011 10:00",8.11,5.654211998,4.153537273,0.00456093,100067.9297,276.4754944,7.015838168,233.699,2011-01-12,2011,1,12,10
"12/01/2011 11:00",8.48,7.108798027,3.025286675,0.004965289,100043.7813,277.3733521,7.725760082,246.946,2011-01-12,2011,1,12,11
"12/01/2011 12:00",8.34,8.167159081,2.88752532,0.005278252,100037.7656,277.8720093,8.662579865,250.528,2011-01-12,2011,1,12,12
"12/01/2011 13:00",10.09,8.998519897,2.980655432,0.005514943,100053.6406,278.581604,9.479328412,251.673,2011-01-12,2011,1,12,13
"12/01/2011 14:00",9.71,9.560686111,2.947285175,0.005728862,100074.0938,279.181427,10.00465936,252.866,2011-01-12,2011,1,12,14
"12/01/2011 15:00",9.36,9.728626251,2.852112055,0.005722092,100087.4141,279.0899963,10.13808226,253.66,2011-01-12,2011,1,12,15
"12/01/2011 16:00",8.66,9.462284088,2.793555498,0.005638016,100108.9688,278.8477783,9.866041379,253.551,2011-01-12,2011,1,12,16
"12/01/2011 17:00",8.46,9.186197281,2.801162243,0.005607607,100138.1797,278.8165894,9.603787294,253.041,2011-01-12,2011,1,12,17
"12/01/2011 18:00",9.41,8.965490341,2.806266069,0.00561548,100173.5703,278.8892212,9.39442102,252.619,2011-01-12,2011,1,12,18
"12/01/2011 19:00",5.56,8.430112839,2.760885477,0.005600495,100193.5938,278.7941589,8.870698456,251.866,2011-01-12,2011,1,12,19
"12/01/2011 20:00",5.58,7.568576813,2.764071941,0.005516835,100201.5625,278.4680786,8.057508838,249.937,2011-01-12,2011,1,12,20
"12/01/2011 21:00",6.1,6.344352722,2.904824734,0.00543343,100228.6094,278.2382507,6.977737326,245.398,2011-01-12,2011,1,12,21
"12/01/2011 22:00",4.66,5.076528549,3.248939276,0.00544171,100249.0703,278.3192139,6.027167538,237.381,2011-01-12,2011,1,12,22
"12/01/2011 23:00",4.85,3.92708993,3.730721474,0.005510932,100251.9141,278.5111084,5.416670382,226.468,2011-01-12,2011,1,12,23
"13/01/2011 00:00",5.33,2.550632,4.065927505,0.005572169,100217.4219,278.6807251,4.799738543,212.1,2011-01-13,2011,1,13,0
"13/01/2011 01:00",5.55,0.873203814,4.442819595,0.005595452,100158.6016,278.7398987,4.52781745,191.119,2011-01-13,2011,1,13,1
"13/01/2011 02:00",6.3,-0.772772431,5.143940449,0.005542316,100077.5859,278.5358276,5.20166325,171.456,2011-01-13,2011,1,13,2
"13/01/2011 03:00",6.98,-1.917642713,6.19244194,0.005458866,99936.10938,278.2525024,6.482568222,162.793,2011-01-13,2011,1,13,3
"13/01/2011 04:00",6.93,-0.639217258,7.683301449,0.005406408,99873.65625,278.1865845,7.709845644,175.244,2011-01-13,2011,1,13,4
"13/01/2011 05:00",8.19,1.453714371,8.15746212,0.005429965,99829.64844,278.3112488,8.285980552,190.104,2011-01-13,2011,1,13,5
"13/01/2011 06:00",7.42,3.585024118,7.993255615,0.005552026,99747.40625,278.808075,8.760395725,204.156,2011-01-13,2011,1,13,6
"13/01/2011 07:00",7.83,7.028583527,7.072963715,0.005765552,99723.35938,279.6803589,9.971349061,224.819,2011-01-13,2011,1,13,7
"13/01/2011 08:00",11.35,9.904240608,5.182810307,0.006070872,99755.90625,280.5689697,11.17834982,242.377,2011-01-13,2011,1,13,8
"13/01/2011 09:00",11.5,10.77062416,4.013576508,0.006338301,99819.96875,280.9827576,11.49413508,249.562,2011-01-13,2011,1,13,9
"13/01/2011 10:00",8.76,10.82943344,3.803391933,0.006529805,99877.59375,281.2658691,11.47791004,250.648,2011-01-13,2011,1,13,10
"13/01/2011 11:00",8.41,10.88796616,3.574057817,0.006553681,99944.28125,281.2940063,11.45956789,251.827,2011-01-13,2011,1,13,11
"13/01/2011 12:00",6.96,10.68880367,3.075670958,0.006485901,100004.8281,281.1150513,11.12251212,253.946,2011-01-13,2011,1,13,12
"13/01/2011 13:00",9.19,10.20828056,2.648918629,0.006446183,100083.7969,281.0182495,10.5463625,255.453,2011-01-13,2011,1,13,13
"13/01/2011 14:00",9.12,9.845783234,2.593618631,0.006414156,100178.7656,281.1962891,10.18166514,255.242,2011-01-13,2011,1,13,14
"13/01/2011 15:00",12.8,9.380355835,2.630100966,0.006330021,100209.2656,281.2401428,9.742099706,254.337,2011-01-13,2011,1,13,15
"13/01/2011 16:00",9.69,8.745851517,2.505971432,0.006246324,100189,280.9564819,9.097791576,254.011,2011-01-13,2011,1,13,16
"13/01/2011 17:00",8.49,7.967545033,2.412478209,0.00616108,100180.7031,280.5388794,8.324771766,253.154,2011-01-13,2011,1,13,17
"13/01/2011 18:00",5.48,7.214205265,2.768121004,0.006075812,100179.0938,280.0963135,7.727046751,249.007,2011-01-13,2011,1,13,18
"13/01/2011 19:00",6.79,6.509124279,3.417180777,0.005952404,100179.2891,279.6850586,7.351586451,242.301,2011-01-13,2011,1,13,19
"13/01/2011 20:00",5.92,5.783534527,4.016291142,0.005852092,100170.1406,279.4435425,7.041297193,235.222,2011-01-13,2011,1,13,20
"13/01/2011 21:00",5.53,5.046257496,4.124069214,0.005767235,100173.6406,279.2727661,6.517105308,230.742,2011-01-13,2011,1,13,21
"13/01/2011 22:00",5.06,4.329009533,4.084145069,0.00573597,100167.1875,279.1565857,5.95151783,226.667,2011-01-13,2011,1,13,22
"13/01/2011 23:00",6.11,3.536014557,4.309951782,0.005674217,100113.7031,278.9633484,5.57486173,219.366,2011-01-13,2011,1,13,23
"14/01/2011 00:00",6.41,2.788916588,4.678565025,0.005597261,100045.8984,278.7228394,5.446744572,210.799,2011-01-14,2011,1,14,0
"14/01/2011 01:00",8.28,2.274977684,5.322579861,0.005535767,100009.5781,278.5653687,5.78838318,203.142,2011-01-14,2011,1,14,1
"14/01/2011 02:00",8.6,1.850035906,5.988285542,0.005536037,99980.24219,278.5715332,6.267551083,197.168,2011-01-14,2011,1,14,2
"14/01/2011 03:00",8.29,1.469659328,6.62763834,0.005598246,99918.14063,278.7203369,6.788629354,192.502,2011-01-14,2011,1,14,3
"14/01/2011 04:00",10.51,1.19897449,7.346838951,0.005729421,99826.39063,279.0819397,7.444029984,189.268,2011-01-14,2011,1,14,4
"14/01/2011 05:00",12.16,1.860691309,8.034074783,0.00588333,99754.21875,279.523468,8.246728428,193.039,2011-01-14,2011,1,14,5
"14/01/2011 06:00",10.85,3.759444237,8.346935272,0.006058906,99700.46875,280.1015015,9.1544934,204.246,2011-01-14,2011,1,14,6
"14/01/2011 07:00",10.12,5.822849274,7.950949669,0.006165507,99669.96875,280.6656799,9.855109046,216.217,2011-01-14,2011,1,14,7
"14/01/2011 08:00",11.23,7.224508286,7.394953728,0.006112411,99667.79688,280.3005371,10.33822328,224.332,2011-01-14,2011,1,14,8
"14/01/2011 09:00",10.16,7.981343269,7.382666588,0.005998492,99693.25781,279.9296265,10.87224017,227.231,2011-01-14,2011,1,14,9
"14/01/2011 10:00",8.57,8.242442131,7.742706299,0.005998927,99706.25781,280.1404419,11.30872907,226.79,2011-01-14,2011,1,14,10
"14/01/2011 11:00",10.99,8.504002571,8.253790855,0.005961142,99693.57813,280.5236206,11.85087015,225.855,2011-01-14,2011,1,14,11
"14/01/2011 12:00",10.69,8.825120926,8.64285183,0.005824178,99635.60938,280.6703186,12.35239439,225.597,2011-01-14,2011,1,14,12
"14/01/2011 13:00",12.14,9.04920578,8.773799896,0.005749153,99590.89063,280.6295776,12.60427268,225.885,2011-01-14,2011,1,14,13
"14/01/2011 14:00",10.92,9.592276573,8.589723587,0.005682903,99584.01563,280.6322021,12.87614543,228.156,2011-01-14,2011,1,14,14
"14/01/2011 15:00",12.27,10.28748798,7.832904816,0.005618233,99615.98438,280.6408386,12.93007374,232.714,2011-01-14,2011,1,14,15
"14/01/2011 16:00",10.82,10.75809193,6.807657242,0.005576018,99681.26563,280.2377014,12.73109339,237.674,2011-01-14,2011,1,14,16
"14/01/2011 17:00",10.58,11.25182533,5.981851578,0.005532555,99776.50781,279.9021912,12.74308132,242.003,2011-01-14,2011,1,14,17
"14/01/2011 18:00",12.81,11.62971783,5.286736012,0.005458589,99876.15625,279.8652344,12.77497219,245.554,2011-01-14,2011,1,14,18
"14/01/2011 19:00",11.56,11.73137379,4.683168411,0.005310118,99975.41406,279.7971497,12.6315952,248.238,2011-01-14,2011,1,14,19
"14/01/2011 20:00",12.39,10.87870789,4.571614742,0.005058622,100058.6719,279.3947449,11.80025197,247.206,2011-01-14,2011,1,14,20
"14/01/2011 21:00",11.05,9.970694542,5.335765839,0.004855873,100157.9063,278.6860962,11.30863151,241.846,2011-01-14,2011,1,14,21
"14/01/2011 22:00",10.13,9.058071136,6.476392746,0.004752533,100232.3281,278.1550903,11.13518369,234.435,2011-01-14,2011,1,14,22
"14/01/2011 23:00",8.43,7.587660789,7.511964798,0.004716418,100208.2031,277.9917603,10.67718181,225.287,2011-01-14,2011,1,14,23
"15/01/2011 00:00",11.34,6.589539051,8.568745613,0.004730581,100184.4531,278.1795959,10.80950629,217.561,2011-01-15,2011,1,15,0
"15/01/2011 01:00",10.3,5.31737709,9.804223061,0.004782899,100114.8594,278.5497437,11.15335326,208.473,2011-01-15,2011,1,15,1
"15/01/2011 02:00",11.46,4.238083839,11.23510361,0.004949104,100028.8438,279.0617065,12.00786857,200.667,2011-01-15,2011,1,15,2
"15/01/2011 03:00",13.94,3.949275017,12.75301456,0.005398388,99902.67188,280.0172424,13.35051136,197.206,2011-01-15,2011,1,15,3
"15/01/2011 04:00",18.08,4.01326561,13.96261311,0.005733645,99734.49219,280.9737244,14.52793398,196.036,2011-01-15,2011,1,15,4
"15/01/2011 05:00",18.61,5.522714138,14.418293,0.005694959,99636.3125,281.0690613,15.4398039,200.958,2011-01-15,2011,1,15,5
"15/01/2011 06:00",19.14,6.962504387,13.8692131,0.005770541,99532.54688,281.4087524,15.518748,206.657,2011-01-15,2011,1,15,6
"15/01/2011 07:00",18.26,7.865799904,13.20553017,0.006105679,99485.34375,282.44104,15.37064849,210.779,2011-01-15,2011,1,15,7
"15/01/2011 08:00",16.5,8.329010963,12.98324013,0.006349555,99451.5625,282.8609314,15.42520495,212.68,2011-01-15,2011,1,15,8
"15/01/2011 09:00",17.14,8.350568771,13.34362602,0.006509822,99427.00781,283.0740356,15.7411675,212.038,2011-01-15,2011,1,15,9
"15/01/2011 10:00",17.24,8.828760147,13.81071663,0.006653949,99417.28125,283.3781128,16.39154964,212.589,2011-01-15,2011,1,15,10
"15/01/2011 11:00",17.93,9.684006691,13.74887371,0.006775912,99445.14844,283.7443848,16.81700074,215.158,2011-01-15,2011,1,15,11
"15/01/2011 12:00",17.93,9.768131256,13.5529604,0.00687596,99426.07813,283.9290771,16.70626002,215.781,2011-01-15,2011,1,15,12
"15/01/2011 13:00",18.99,9.912279129,13.35356617,0.006939189,99418.03125,284.0331726,16.63042414,216.586,2011-01-15,2011,1,15,13
"15/01/2011 14:00",19.17,10.16975975,13.05329418,0.006963908,99430.4375,284.1575928,16.54728082,217.921,2011-01-15,2011,1,15,14
"15/01/2011 15:00",19.68,10.19925594,12.71547985,0.006986568,99457.27344,284.2689819,16.3005598,218.733,2011-01-15,2011,1,15,15
"15/01/2011 16:00",19.73,10.14696121,12.58299923,0.006985653,99485.59375,284.2299805,16.16455046,218.882,2011-01-15,2011,1,15,16
"15/01/2011 17:00",19.48,10.11367893,12.52424145,0.006992226,99534.42188,284.087616,16.09792301,218.921,2011-01-15,2011,1,15,17
"15/01/2011 18:00",19.62,10.05334949,12.4174881,0.007007285,99581.17188,283.9570923,15.97697865,218.994,2011-01-15,2011,1,15,18
"15/01/2011 19:00",19.36,9.952287674,12.35920906,0.007006407,99602.64063,283.8528442,15.86814666,218.842,2011-01-15,2011,1,15,19
"15/01/2011 20:00",19.22,9.86288166,12.41060638,0.006982041,99615.84375,283.7867432,15.85243153,218.474,2011-01-15,2011,1,15,20
"15/01/2011 21:00",19.92,9.723237991,12.54918289,0.00695679,99636.9375,283.788208,15.87524325,217.768,2011-01-15,2011,1,15,21
"15/01/2011 22:00",19.87,9.700716019,12.80558395,0.006939435,99648.48438,283.7929077,16.06508237,217.145,2011-01-15,2011,1,15,22
"15/01/2011 23:00",20.19,9.761069298,13.01819706,0.006907538,99642.21875,283.811554,16.27119936,216.862,2011-01-15,2011,1,15,23
"16/01/2011 00:00",21.89,9.843597412,13.21318436,0.006860043,99635.625,283.8628235,16.47679128,216.685,2011-01-16,2011,1,16,0
"16/01/2011 01:00",21.59,9.815541267,13.35066891,0.006805829,99648.125,283.8831482,16.57061286,216.323,2011-01-16,2011,1,16,1
"16/01/2011 02:00",22.2,9.712050438,13.46056747,0.006745921,99656.875,283.8079834,16.59851802,215.811,2011-01-16,2011,1,16,2
"16/01/2011 03:00",22.14,9.721226692,13.41985416,0.006695142,99667.48438,283.7358093,16.57090022,215.919,2011-01-16,2011,1,16,3
"16/01/2011 04:00",19.24,9.880275726,13.2047348,0.006658391,99685.34375,283.633728,16.49196379,216.805,2011-01-16,2011,1,16,4
"16/01/2011 05:00",17.33,10.25078392,12.75728321,0.006667621,99712.98438,283.5024414,16.36541615,218.782,2011-01-16,2011,1,16,5
"16/01/2011 06:00",16.92,10.46379852,12.12796307,0.006707307,99771.14063,283.3835449,16.01807004,220.787,2011-01-16,2011,1,16,6
"16/01/2011 07:00",14.9,10.40643311,11.53081131,0.00667129,99843.40625,283.2468872,15.53233593,222.065,2011-01-16,2011,1,16,7
"16/01/2011 08:00",13.61,10.39011669,11.15805817,0.006534148,99924.45313,283.1104736,15.2465336,222.958,2011-01-16,2011,1,16,8
"16/01/2011 09:00",13.95,10.37510014,10.83343029,0.00632788,100006.4531,283.061554,15.00019715,223.761,2011-01-16,2011,1,16,9
"16/01/2011 10:00",15.77,10.40726852,10.41892433,0.006197832,100110.2422,283.0432739,14.7263445,224.967,2011-01-16,2011,1,16,10
"16/01/2011 11:00",14.53,10.52810001,9.75902462,0.006120253,100213.5156,282.8570557,14.35546765,227.171,2011-01-16,2011,1,16,11
"16/01/2011 12:00",13.91,10.45673561,8.939810753,0.005936795,100283.1875,282.4494629,13.75730846,229.471,2011-01-16,2011,1,16,12
"16/01/2011 13:00",12.64,10.20029736,8.444459915,0.005799086,100332.7344,281.9487915,13.24216634,230.379,2011-01-16,2011,1,16,13
"16/01/2011 14:00",11.8,9.942386627,8.224686623,0.005515909,100395.4688,281.5852051,12.90335313,230.401,2011-01-16,2011,1,16,14
"16/01/2011 15:00",9.47,9.7768116,8.210482597,0.005286817,100465.2188,281.0428772,12.76706973,229.976,2011-01-16,2011,1,16,15
"16/01/2011 16:00",10.94,9.72603035,8.249275208,0.00519555,100509.9219,280.4797058,12.75328224,229.696,2011-01-16,2011,1,16,16
"16/01/2011 17:00",13.59,9.737922668,8.282446861,0.005127327,100557.4766,280.1138916,12.7838204,229.617,2011-01-16,2011,1,16,17
"16/01/2011 18:00",11.03,9.93424511,8.460783958,0.005051574,100613.4531,279.8998718,13.04891149,229.579,2011-01-16,2011,1,16,18
"16/01/2011 19:00",9.96,10.25937653,8.8670578,0.004967113,100668.7891,279.8307495,13.56021831,229.163,2011-01-16,2011,1,16,19
"16/01/2011 20:00",12.23,10.56272316,9.406555176,0.004898355,100725.4219,279.7713928,14.14405885,228.313,2011-01-16,2011,1,16,20
"16/01/2011 21:00",13.19,10.83281422,9.886089325,0.004851832,100797.0625,279.6546326,14.66576374,227.616,2011-01-16,2011,1,16,21
"16/01/2011 22:00",12.29,11.06462097,9.919539452,0.004851857,100864.5313,279.5732117,14.86011777,228.123,2011-01-16,2011,1,16,22
"16/01/2011 23:00",12.62,11.27374268,9.421634674,0.004883289,100904.9219,279.5551147,14.69232704,230.113,2011-01-16,2011,1,16,23
"17/01/2011 00:00",13.21,11.28056717,8.724527359,0.004946415,100952.0313,279.4369202,14.26073537,232.281,2011-01-17,2011,1,17,0
"17/01/2011 01:00",12.03,11.1280117,8.096304893,0.005010425,101020.0781,279.2205811,13.76164225,233.961,2011-01-17,2011,1,17,1
"17/01/2011 02:00",16.58,11.03497791,7.530846596,0.005051299,101082.3672,279.0371704,13.35980494,235.688,2011-01-17,2011,1,17,2
"17/01/2011 03:00",16.62,10.98403168,6.739183426,0.005045007,101135.6719,279.0029297,12.88664212,238.469,2011-01-17,2011,1,17,3
"17/01/2011 04:00",16.2,11.09082603,5.844752789,0.005005554,101199.5313,278.9848022,12.53664857,242.211,2011-01-17,2011,1,17,4
"17/01/2011 05:00",18.11,11.00829029,4.902076721,0.004942712,101250.1094,278.9191589,12.05042785,245.996,2011-01-17,2011,1,17,5
"17/01/2011 06:00",15.94,10.61338139,4.133980751,0.004895529,101308.2813,278.7549438,11.39006854,248.718,2011-01-17,2011,1,17,6
"17/01/2011 07:00",6.81,10.02232456,3.723595858,0.004863838,101401.8281,278.5372314,10.69168629,249.618,2011-01-17,2011,1,17,7
"17/01/2011 08:00",6.07,9.394412041,3.359475136,0.004839701,101493.3516,278.2984924,9.977026149,250.322,2011-01-17,2011,1,17,8
"17/01/2011 09:00",7.43,8.776973724,2.909254074,0.004846013,101542.625,278.352478,9.246568392,251.661,2011-01-17,2011,1,17,9
"17/01/2011 10:00",9.65,8.103645325,2.414919615,0.004883715,101581.5,278.7209167,8.455820735,253.405,2011-01-17,2011,1,17,10
"17/01/2011 11:00",5.6,7.547559738,2.167191982,0.00492692,101601.1641,279.2006531,7.852539659,253.979,2011-01-17,2011,1,17,11
"17/01/2011 12:00",8.51,7.415146828,2.056814909,0.004901411,101597.2656,279.5588989,7.695121185,254.497,2011-01-17,2011,1,17,12
"17/01/2011 13:00",7.89,7.613891602,1.94224453,0.004823519,101582.1719,279.6033936,7.857713353,255.689,2011-01-17,2011,1,17,13
"17/01/2011 14:00",8.73,7.62775135,1.938260436,0.004845676,101581.2344,279.2910767,7.870161636,255.742,2011-01-17,2011,1,17,14
"17/01/2011 15:00",8.38,7.606592655,1.898420334,0.004807631,101610.5156,278.8744812,7.839914004,255.986,2011-01-17,2011,1,17,15
"17/01/2011 16:00",7.22,7.634176254,1.778319001,0.004800797,101645.9531,278.59198,7.838562722,256.887,2011-01-17,2011,1,17,16
"17/01/2011 17:00",8.05,7.692279816,1.493783474,0.004794964,101690.4531,278.3704224,7.835978422,259.01,2011-01-17,2011,1,17,17
"17/01/2011 18:00",6.35,7.782813072,1.268172264,0.004797024,101746.9531,278.0356445,7.885457514,260.745,2011-01-17,2011,1,17,18
"17/01/2011 19:00",4.97,7.745498657,1.17764926,0.004797607,101780.9688,277.5947571,7.834513848,261.354,2011-01-17,2011,1,17,19
"17/01/2011 20:00",5.73,7.708152294,1.197073698,0.004796798,101821.3438,277.1754456,7.800551085,261.172,2011-01-17,2011,1,17,20
"17/01/2011 21:00",7.04,7.736104965,1.280858994,0.004804318,101873.75,276.8488159,7.841423327,260.598,2011-01-17,2011,1,17,21
"17/01/2011 22:00",8.59,7.850447655,1.340703487,0.004797288,101927.1641,276.6646423,7.964107874,260.308,2011-01-17,2011,1,17,22
"17/01/2011 23:00",9.99,8.031311035,1.324197054,0.004781801,101958.7188,276.5342102,8.139745376,260.637,2011-01-17,2011,1,17,23
"18/01/2011 00:00",9.41,8.110958099,1.005630612,0.004752155,101986.1094,276.4053345,8.173061496,262.932,2011-01-18,2011,1,18,0
"18/01/2011 01:00",11.2,8.0538311,0.401165485,0.004708352,102034.2344,276.2229004,8.063816041,267.148,2011-01-18,2011,1,18,1
"18/01/2011 02:00",10.24,7.817994118,-0.279709041,0.004604194,102081.4844,276.017334,7.822996176,272.049,2011-01-18,2011,1,18,2
"18/01/2011 03:00",9.01,7.206759453,-0.902976751,0.004424413,102121.6797,275.6434631,7.263108758,277.141,2011-01-18,2011,1,18,3
"18/01/2011 04:00",10.89,6.66893816,-1.168834925,0.004304352,102164.0313,275.2910461,6.770591648,279.941,2011-01-18,2011,1,18,4
"18/01/2011 05:00",9.65,6.302427769,-1.163956046,0.004235797,102216.4063,275.0712891,6.409008461,280.463,2011-01-18,2011,1,18,5
"18/01/2011 06:00",8.39,5.992945194,-0.923751652,0.004197075,102269.8125,275.0914001,6.06372074,278.762,2011-01-18,2011,1,18,6
"18/01/2011 07:00",7.22,5.804849625,-0.544439316,0.004189656,102324.5156,275.1169434,5.83032532,275.358,2011-01-18,2011,1,18,7
"18/01/2011 08:00",7.82,5.877083302,-0.19764924,0.004213074,102394.6094,275.4089355,5.880405884,271.926,2011-01-18,2011,1,18,8
"18/01/2011 09:00",8.05,6.290138245,0.183560342,0.004282347,102447.4688,275.7848816,6.292816026,268.328,2011-01-18,2011,1,18,9
"18/01/2011 10:00",8.29,6.803595543,0.165397227,0.00438981,102495.7813,276.4462891,6.805605671,268.607,2011-01-18,2011,1,18,10
"18/01/2011 11:00",8.6,7.355176449,-0.246338427,0.004472555,102539.7969,277.5215149,7.359300457,271.918,2011-01-18,2011,1,18,11
"18/01/2011 12:00",8.68,7.7420187,-0.796622157,0.004425658,102563.0469,278.3033142,7.782895374,275.874,2011-01-18,2011,1,18,12
"18/01/2011 13:00",7.78,8.046774864,-1.34435761,0.004409495,102567.5938,278.4768677,8.158301484,279.484,2011-01-18,2011,1,18,13
"18/01/2011 14:00",8.56,8.204717636,-1.75520885,0.004423988,102590.9766,278.2775879,8.390360516,282.075,2011-01-18,2011,1,18,14
"18/01/2011 15:00",8.99,8.33147049,-1.872668505,0.004416071,102661.6406,277.7668457,8.53933767,282.667,2011-01-18,2011,1,18,15
"18/01/2011 16:00",10.33,8.520934105,-1.578278542,0.004400761,102732.8125,277.2672119,8.665868749,280.493,2011-01-18,2011,1,18,16
"18/01/2011 17:00",9.99,8.638842583,-1.110758543,0.004393253,102787.0781,277.0174255,8.709958996,277.326,2011-01-18,2011,1,18,17
"18/01/2011 18:00",10.68,8.698237419,-0.767904162,0.004424065,102844.8125,277.0310059,8.732067968,275.045,2011-01-18,2011,1,18,18
"18/01/2011 19:00",11.83,8.781979561,-0.585033357,0.004500581,102892.75,277.2070313,8.801444713,273.811,2011-01-18,2011,1,18,19
"18/01/2011 20:00",10.86,8.894690514,-0.429082811,0.004607472,102925.2188,277.4425049,8.905034048,272.761,2011-01-18,2011,1,18,20
"18/01/2011 21:00",10.81,9.091801643,-0.851274669,0.004713674,102973.9688,277.6178284,9.131567537,275.349,2011-01-18,2011,1,18,21
"18/01/2011 22:00",11.52,9.088431358,-1.627710104,0.004788515,103021.625,277.7851563,9.233039843,280.153,2011-01-18,2011,1,18,22
"18/01/2011 23:00",10.61,8.873521805,-2.297981024,0.004825067,103048.7031,277.9385986,9.166248197,284.518,2011-01-18,2011,1,18,23
"19/01/2011 00:00",10.31,8.532423019,-2.904788494,0.004838969,103060.8594,278.0420532,9.013325623,288.8,2011-01-19,2011,1,19,0
"19/01/2011 01:00",10.37,8.14041996,-3.352109432,0.00483032,103094.7344,278.0426025,8.803583064,292.381,2011-01-19,2011,1,19,1
"19/01/2011 02:00",10.68,7.793031693,-3.50942874,0.004814599,103127.9219,277.9203186,8.546779103,294.243,2011-01-19,2011,1,19,2
"19/01/2011 03:00",11.07,7.419763088,-3.416780949,0.004799792,103143.1719,277.7148132,8.168676535,294.725,2011-01-19,2011,1,19,3
"19/01/2011 04:00",11.22,7.144635201,-3.097490072,0.004784983,103156.0156,277.5691528,7.787185428,293.438,2011-01-19,2011,1,19,4
"19/01/2011 05:00",9.92,7.019392967,-2.731309652,0.004754879,103189.9297,277.4923096,7.532060146,291.261,2011-01-19,2011,1,19,5
"19/01/2011 06:00",9.83,6.986279964,-2.453425169,0.004709734,103235.6563,277.4376831,7.404552843,289.35,2011-01-19,2011,1,19,6
"19/01/2011 07:00",9.71,6.934452057,-2.326788187,0.00464938,103281.0547,277.3616333,7.314408288,288.548,2011-01-19,2011,1,19,7
"19/01/2011 08:00",9.34,6.84283638,-2.26582098,0.004602094,103335.1406,277.3313293,7.208214372,288.32,2011-01-19,2011,1,19,8
"19/01/2011 09:00",9.33,6.553758144,-2.214435101,0.004571476,103377.4219,277.5250854,6.917764713,288.669,2011-01-19,2011,1,19,9
"19/01/2011 10:00",9.51,6.033749104,-2.041744709,0.004572303,103400.5156,277.8797607,6.369839064,288.695,2011-01-19,2011,1,19,10
"19/01/2011 11:00",9.53,5.451044083,-1.738034487,0.004634048,103403.2813,278.3423157,5.721419882,287.684,2011-01-19,2011,1,19,11
"19/01/2011 12:00",8.07,5.025900841,-1.468134403,0.004733789,103390.3438,278.7518005,5.235942884,286.283,2011-01-19,2011,1,19,12
"19/01/2011 13:00",8.4,4.758898258,-1.266810179,0.00479428,103385.1953,278.9113464,4.924623911,284.906,2011-01-19,2011,1,19,13
"19/01/2011 14:00",8.62,4.7251091,-1.047039866,0.004824342,103396.5625,278.7293701,4.839726076,282.494,2011-01-19,2011,1,19,14
"19/01/2011 15:00",7.58,5.015184402,-0.849557936,0.004877509,103422.1406,278.4190063,5.086631821,279.614,2011-01-19,2011,1,19,15
"19/01/2011 16:00",7.23,5.40654707,-0.718271673,0.004885867,103455.0547,278.0769348,5.454050367,277.567,2011-01-19,2011,1,19,16
"19/01/2011 17:00",7.49,5.756115437,-0.707669795,0.0048331,103479,277.5704346,5.799453548,277.008,2011-01-19,2011,1,19,17
"19/01/2011 18:00",7.33,6.044344425,-0.790761948,0.004742115,103492.3125,277.115448,6.095851375,277.453,2011-01-19,2011,1,19,18
"19/01/2011 19:00",6.17,6.157244205,-1.018055558,0.004620896,103495.5625,276.7691956,6.240840755,279.388,2011-01-19,2011,1,19,19
"19/01/2011 20:00",6.76,6.144291401,-1.34835434,0.004492729,103497.2188,276.4654541,6.290498887,282.377,2011-01-19,2011,1,19,20
"19/01/2011 21:00",7.08,5.87151432,-1.480285645,0.004409205,103515.4531,276.2185974,6.05523955,284.15,2011-01-19,2011,1,19,21
"19/01/2011 22:00",7.39,5.504301071,-1.493629456,0.004370695,103539.6641,276.0400391,5.703355086,285.182,2011-01-19,2011,1,19,22
"19/01/2011 23:00",6.25,5.004090786,-1.561994553,0.004354789,103555.5,275.9335938,5.242208654,287.335,2011-01-19,2011,1,19,23
"20/01/2011 00:00",6.97,4.377096176,-1.623472571,0.004384673,103565.5938,275.9069214,4.668472355,290.349,2011-01-20,2011,1,20,0
"20/01/2011 01:00",5.14,3.922072649,-1.549761772,0.004414201,103596.7422,275.8647461,4.217157267,291.56,2011-01-20,2011,1,20,1
"20/01/2011 02:00",4.04,3.648849726,-1.370316505,0.004428725,103623.3125,275.7714844,3.897675159,290.583,2011-01-20,2011,1,20,2
"20/01/2011 03:00",3.26,3.553433418,-1.305765152,0.004351581,103631.0469,275.6858826,3.78575114,290.176,2011-01-20,2011,1,20,3
"20/01/2011 04:00",3.05,3.540155411,-1.351407886,0.004190837,103637.2656,275.4709778,3.789327593,290.893,2011-01-20,2011,1,20,4
"20/01/2011 05:00",3.09,3.570262194,-1.31575942,0.004099167,103660.7656,274.9519959,3.804996056,290.23,2011-01-20,2011,1,20,5
"20/01/2011 06:00",5.29,3.618672609,-1.289722562,0.004136737,103695.6719,275.1660156,3.841637117,289.616,2011-01-20,2011,1,20,6
"20/01/2011 07:00",5.61,3.628676891,-1.316333294,0.004128546,103736.6875,275.1185913,3.860055611,289.938,2011-01-20,2011,1,20,7
"20/01/2011 08:00",5.48,3.61743927,-1.379817247,0.004112569,103783.5781,275.0903625,3.871661466,290.878,2011-01-20,2011,1,20,8
"20/01/2011 09:00",5.17,3.712339878,-1.296762228,0.004051169,103792.25,275.0866089,3.932309709,289.254,2011-01-20,2011,1,20,9
"20/01/2011 10:00",4.45,3.834150076,-1.106037855,0.003845068,103791.875,274.9370117,3.990492017,286.091,2011-01-20,2011,1,20,10
"20/01/2011 11:00",2.8,3.914827108,-0.839128256,0.003795499,103772.9297,275.2362061,4.003749183,282.098,2011-01-20,2011,1,20,11
"20/01/2011 12:00",2.75,4.037005901,-0.611383915,0.003840498,103738.7109,275.6773071,4.083038934,278.611,2011-01-20,2011,1,20,12
"20/01/2011 13:00",3.65,4.252919197,-0.378210902,0.003900716,103701.6094,275.8856201,4.269703173,275.081,2011-01-20,2011,1,20,13
"20/01/2011 14:00",4.97,4.704463959,-0.19268769,0.004010063,103665.6094,275.9046936,4.708408403,272.345,2011-01-20,2011,1,20,14
"20/01/2011 15:00",3.68,5.143070698,-0.430889219,0.004115587,103668.8125,275.9109497,5.161089199,274.789,2011-01-20,2011,1,20,15
"20/01/2011 16:00",5.08,5.313361645,-0.870192528,0.00411465,103700.625,275.8587036,5.384147751,279.301,2011-01-20,2011,1,20,16
"20/01/2011 17:00",5.1,5.298413754,-1.259753227,0.004038386,103734.8281,275.6643372,5.446114808,283.374,2011-01-20,2011,1,20,17
"20/01/2011 18:00",4.81,5.189236164,-1.510980845,0.003962806,103772,275.506134,5.404741907,286.234,2011-01-20,2011,1,20,18
"20/01/2011 19:00",5.57,5.049108505,-1.703421593,0.003913353,103801.9922,275.3746948,5.328709208,288.642,2011-01-20,2011,1,20,19
"20/01/2011 20:00",5.71,4.89304781,-1.807581544,0.003883236,103819.8047,275.272644,5.216250368,290.275,2011-01-20,2011,1,20,20
"20/01/2011 21:00",5.39,5.009318829,-1.563417912,0.003876952,103826.3203,275.0661011,5.247623338,287.333,2011-01-20,2011,1,20,21
"20/01/2011 22:00",4.05,5.329168797,-1.347204208,0.00386521,103812.2344,274.8295898,5.496817192,284.187,2011-01-20,2011,1,20,22
"20/01/2011 23:00",3.43,5.600797653,-1.320359707,0.003849912,103791.2188,274.7498779,5.754327424,283.264,2011-01-20,2011,1,20,23
"21/01/2011 00:00",5.63,5.753682137,-1.332193851,0.003876419,103776.8906,274.7028809,5.90589524,283.036,2011-01-21,2011,1,21,0
"21/01/2011 01:00",6.25,5.822350025,-1.339431047,0.003932924,103781.9375,274.6650085,5.974431801,282.955,2011-01-21,2011,1,21,1
"21/01/2011 02:00",5.4,5.796445847,-1.396604538,0.003977974,103790.2031,274.7171631,5.962322424,283.546,2011-01-21,2011,1,21,2
"21/01/2011 03:00",5.05,5.622200489,-1.681980729,0.004030534,103804.4063,274.7700806,5.868406727,286.655,2011-01-21,2011,1,21,3
"21/01/2011 04:00",5.86,5.332528591,-1.963352323,0.004098386,103819.6875,274.8750916,5.682483042,290.212,2011-01-21,2011,1,21,4
"21/01/2011 05:00",8.07,5.079426765,-2.077465057,0.004136,103819.7656,274.8991089,5.487844507,292.244,2011-01-21,2011,1,21,5
"21/01/2011 06:00",7.06,4.843612671,-1.995776176,0.004036847,103838.7734,274.4460449,5.238674093,292.393,2011-01-21,2011,1,21,6
"21/01/2011 07:00",6.34,4.599782944,-1.958427906,0.003842908,103873.2813,273.8885498,4.999344256,293.062,2011-01-21,2011,1,21,7
"21/01/2011 08:00",5.69,4.524011612,-1.97570765,0.00382459,103917.1172,273.8460083,4.936608328,293.591,2011-01-21,2011,1,21,8
"21/01/2011 09:00",6.22,4.458469868,-1.67500329,0.003844046,103945.5156,274.0658569,4.762729216,290.59,2011-01-21,2011,1,21,9
"21/01/2011 10:00",5.36,4.368333817,-1.325428247,0.003866874,103972.2344,274.2417908,4.56498635,286.878,2011-01-21,2011,1,21,10
"21/01/2011 11:00",4.65,4.364871502,-1.229124427,0.003908522,103975.2344,274.4108276,4.534627888,285.726,2011-01-21,2011,1,21,11
"21/01/2011 12:00",5.56,4.29630661,-1.35870719,0.003984513,103969.75,274.7111511,4.506033257,287.549,2011-01-21,2011,1,21,12
"21/01/2011 13:00",4.98,4.182191849,-1.493212819,0.004037682,103971.0313,274.8818665,4.440767184,289.648,2011-01-21,2011,1,21,13
"21/01/2011 14:00",4.91,4.085474014,-1.547937751,0.004060408,103968.5469,274.8677979,4.368891072,290.751,2011-01-21,2011,1,21,14
"21/01/2011 15:00",5.2,4.211185455,-1.719854832,0.004121457,103968.5938,274.9257813,4.548844203,292.215,2011-01-21,2011,1,21,15
"21/01/2011 16:00",5.23,4.30288744,-2.000215769,0.00416757,103986.0156,274.9833984,4.74507149,294.931,2011-01-21,2011,1,21,16
"21/01/2011 17:00",5.39,4.17742157,-2.31268692,0.004206297,104027.9531,275.1137695,4.774868769,298.969,2011-01-21,2011,1,21,17
"21/01/2011 18:00",5.39,3.953774452,-2.540134668,0.004229702,104059.7734,275.1864929,4.699427258,302.719,2011-01-21,2011,1,21,18
"21/01/2011 19:00",4.41,3.732728004,-2.649275303,0.004222355,104064.5156,275.1486206,4.577326511,305.364,2011-01-21,2011,1,21,19
"21/01/2011 20:00",7.23,3.561250687,-2.693201303,0.004191906,104080.7969,275.0055237,4.464956855,307.098,2011-01-21,2011,1,21,20
"21/01/2011 21:00",7.43,3.509526253,-2.66511178,0.004130837,104107.8281,274.7921448,4.406766992,307.212,2011-01-21,2011,1,21,21
"21/01/2011 22:00",7.64,3.527924299,-2.70732832,0.004069724,104099.8047,274.5757141,4.447007588,307.502,2011-01-21,2011,1,21,22
"21/01/2011 23:00",6.8,3.472196579,-2.850649357,0.004030924,104084.25,274.4738464,4.492477138,309.385,2011-01-21,2011,1,21,23
"22/01/2011 00:00",6.25,3.31744194,-3.103407621,0.004052971,104071.6797,274.6022949,4.542748055,313.09,2011-01-22,2011,1,22,0
"22/01/2011 01:00",7.25,3.088140965,-3.326004982,0.004166882,104087.8047,275.0411682,4.538603723,317.123,2011-01-22,2011,1,22,1
"22/01/2011 02:00",6.5,2.977080345,-3.289144516,0.00428865,104098.2188,275.4515686,4.436381299,317.851,2011-01-22,2011,1,22,2
"22/01/2011 03:00",6.13,2.821623564,-3.268084526,0.004334352,104098.7031,275.5576782,4.317630832,319.193,2011-01-22,2011,1,22,3
"22/01/2011 04:00",5.21,2.677612782,-3.168858051,0.004349264,104106.8984,275.6175537,4.148646955,319.802,2011-01-22,2011,1,22,4
"22/01/2011 05:00",5.58,2.704879045,-3.06263113,0.004333758,104112.1484,275.5896606,4.086083711,318.549,2011-01-22,2011,1,22,5
"22/01/2011 06:00",5.75,2.884649992,-2.856911659,0.004257258,104116.2656,275.3464966,4.059944557,314.723,2011-01-22,2011,1,22,6
"22/01/2011 07:00",5.18,3.131408691,-2.607170105,0.004134995,104115.8672,274.9888916,4.074684816,309.78,2011-01-22,2011,1,22,7
"22/01/2011 08:00",4.54,3.378310919,-2.442152977,0.004028036,104115.7344,274.6809387,4.168584391,305.862,2011-01-22,2011,1,22,8
"22/01/2011 09:00",4.3,3.397295952,-2.369129181,0.004020318,104128.9844,274.7157898,4.141786192,304.89,2011-01-22,2011,1,22,9
"22/01/2011 10:00",4.64,3.14759016,-2.441361427,0.004043209,104120.3594,274.8511047,3.983411783,307.798,2011-01-22,2011,1,22,10
"22/01/2011 11:00",4.7,2.777047157,-2.657091379,0.004096762,104101.5781,274.9298706,3.843452291,313.735,2011-01-22,2011,1,22,11
"22/01/2011 12:00",4.55,2.363832712,-2.87044096,0.004135218,104081.2031,275.0326233,3.718485766,320.528,2011-01-22,2011,1,22,12
"22/01/2011 13:00",3.97,1.96382618,-2.918351412,0.004204355,104087.7188,275.2053223,3.517582725,326.062,2011-01-22,2011,1,22,13
"22/01/2011 14:00",4.63,1.652193189,-2.87228632,0.004288903,104094.25,275.4419556,3.313573756,330.091,2011-01-22,2011,1,22,14
"22/01/2011 15:00",5.27,1.906790018,-2.982049465,0.004434627,104076.9375,275.8288269,3.539557484,327.404,2011-01-22,2011,1,22,15
"22/01/2011 16:00",4.87,2.379270077,-3.213911057,0.004473463,104071.7031,275.8843689,3.998768608,323.487,2011-01-22,2011,1,22,16
"22/01/2011 17:00",5.53,2.752993107,-3.435946465,0.004390186,104076.7969,275.6775513,4.402805827,321.297,2011-01-22,2011,1,22,17
"22/01/2011 18:00",6.92,2.98073864,-3.647522926,0.004296854,104088.5313,275.4227295,4.710544166,320.744,2011-01-22,2011,1,22,18
"22/01/2011 19:00",6.91,3.065945864,-3.876307249,0.004245465,104072.9219,275.2331848,4.942244625,321.657,2011-01-22,2011,1,22,19
"22/01/2011 20:00",7.46,3.055738449,-4.148569107,0.004232896,104043.8594,275.1741638,5.152490961,323.625,2011-01-22,2011,1,22,20
"22/01/2011 21:00",7.09,2.915483713,-4.500567913,0.004256422,104033.25,275.1959534,5.362383502,327.064,2011-01-22,2011,1,22,21
"22/01/2011 22:00",7.68,2.820161819,-4.733764648,0.004265124,104024.1328,275.244812,5.510157932,329.215,2011-01-22,2011,1,22,22
"22/01/2011 23:00",8.7,2.8263762,-4.920376778,0.004265621,103997.3281,275.2436218,5.674373098,330.125,2011-01-22,2011,1,22,23
"23/01/2011 00:00",8.4,2.881451607,-5.113201141,0.004230323,103951.0781,275.1677551,5.869206869,330.597,2011-01-23,2011,1,23,0
"23/01/2011 01:00",7.81,2.908673286,-5.277957916,0.004215181,103923.4844,275.1171875,6.026377025,331.14,2011-01-23,2011,1,23,1
"23/01/2011 02:00",7.79,2.86529851,-5.412465572,0.004184836,103930.3594,274.9771423,6.124109659,332.103,2011-01-23,2011,1,23,2
"23/01/2011 03:00",8.3,2.716607332,-5.571129322,0.00417897,103937.9922,274.9497986,6.198180162,334.005,2011-01-23,2011,1,23,3
"23/01/2011 04:00",7.39,2.474124193,-5.776198864,0.00421968,103924.0469,275.0567627,6.283769875,336.813,2011-01-23,2011,1,23,4
"23/01/2011 05:00",8.23,2.17896843,-5.939952374,0.004287523,103924.1172,275.2623901,6.327000681,339.855,2011-01-23,2011,1,23,5
"23/01/2011 06:00",8.24,1.887408257,-5.991133213,0.004355869,103928.1563,275.4902649,6.281400091,342.513,2011-01-23,2011,1,23,6
"23/01/2011 07:00",8.48,1.718670845,-5.921531677,0.004417272,103918.3906,275.6646118,6.165903574,343.815,2011-01-23,2011,1,23,7
"23/01/2011 08:00",8.64,1.728389144,-5.750330925,0.00446415,103897.9688,275.7774048,6.004467901,343.27,2011-01-23,2011,1,23,8
"23/01/2011 09:00",8.47,1.978851438,-5.465463638,0.004504347,103886.4844,276.0701599,5.812671141,340.096,2011-01-23,2011,1,23,9
"23/01/2011 10:00",8.75,2.279572725,-5.197739601,0.004565542,103874.1719,276.480896,5.67564523,336.319,2011-01-23,2011,1,23,10
"23/01/2011 11:00",8.37,2.458473682,-5.079440117,0.00470153,103840.2734,277.1954041,5.643120125,334.172,2011-01-23,2011,1,23,11
"23/01/2011 12:00",9.24,2.49034977,-5.093379974,0.004888547,103796.1797,278.0108948,5.669599769,333.944,2011-01-23,2011,1,23,12
"23/01/2011 13:00",8.94,2.42510581,-5.158534527,0.005060572,103774.4688,278.7444458,5.70014181,334.821,2011-01-23,2011,1,23,13
"23/01/2011 14:00",8.79,2.417179585,-5.451218128,0.005057211,103767.1328,279.3542786,5.963097871,336.086,2011-01-23,2011,1,23,14
"23/01/2011 15:00",8.76,2.536221027,-5.792218685,0.005055911,103762.8438,279.1331482,6.323149089,336.352,2011-01-23,2011,1,23,15
"23/01/2011 16:00",8.63,2.653957129,-6.010028362,0.005048971,103771.5469,278.5730591,6.56992613,336.174,2011-01-23,2011,1,23,16
"23/01/2011 17:00",8.35,2.776023626,-5.968019485,0.005011556,103791.4219,277.9819336,6.582063791,335.054,2011-01-23,2011,1,23,17
"23/01/2011 18:00",7.47,2.959464073,-5.698206425,0.004953457,103801.4609,277.5255127,6.420902122,332.554,2011-01-23,2011,1,23,18
"23/01/2011 19:00",7.53,3.197090149,-5.179050446,0.004885009,103784.9375,277.1806641,6.086374039,328.312,2011-01-23,2011,1,23,19
"23/01/2011 20:00",7.24,3.535540581,-4.488369465,0.004816509,103763.6875,276.9976807,5.713624738,321.772,2011-01-23,2011,1,23,20
"23/01/2011 21:00",7.93,3.977813959,-3.395747662,0.004732825,103727.25,276.8218079,5.230115302,310.486,2011-01-23,2011,1,23,21
"23/01/2011 22:00",6.68,4.657786369,-2.306800842,0.004596519,103688.1172,276.4394836,5.197721038,296.347,2011-01-23,2011,1,23,22
"23/01/2011 23:00",7.1,5.390005112,-1.633993387,0.004369773,103636.8594,275.8097229,5.632236633,286.864,2011-01-23,2011,1,23,23
"24/01/2011 00:00",6.91,5.889826775,-1.412353516,0.004204663,103590.6875,275.4963684,6.05679799,283.484,2011-01-24,2011,1,24,0
"24/01/2011 01:00",8.46,6.293023586,-1.588996887,0.004193023,103558.8594,275.5626831,6.490535954,284.171,2011-01-24,2011,1,24,1
"24/01/2011 02:00",9.09,6.557195663,-1.971021414,0.004231478,103525.1719,275.4816589,6.847024199,286.73,2011-01-24,2011,1,24,2
"24/01/2011 03:00",9.61,6.620995522,-2.47492671,0.004270114,103473.9453,275.6990967,7.068439992,290.495,2011-01-24,2011,1,24,3
"24/01/2011 04:00",10.3,6.647910118,-2.897208929,0.00434588,103395.3281,276.1434937,7.251794848,293.547,2011-01-24,2011,1,24,4
"24/01/2011 05:00",11.69,6.751716137,-3.14274025,0.004429517,103325.0156,276.9279785,7.447314084,294.96,2011-01-24,2011,1,24,5
"24/01/2011 06:00",10.82,6.910189629,-3.107539177,0.004490439,103256.6563,277.1316223,7.576775069,294.213,2011-01-24,2011,1,24,6
"24/01/2011 07:00",9.73,7.09486866,-2.920814037,0.004543791,103193.7422,277.0322876,7.672569058,292.375,2011-01-24,2011,1,24,7
"24/01/2011 08:00",9.03,7.300011635,-2.654299736,0.004597232,103138.5,276.9674988,7.767591451,289.981,2011-01-24,2011,1,24,8
"24/01/2011 09:00",9.45,7.588390827,-2.301772356,0.004665898,103066.7031,277.3341675,7.929806512,286.874,2011-01-24,2011,1,24,9
"24/01/2011 10:00",10.49,7.798049927,-2.049628735,0.004780548,103001.1563,277.9758606,8.062912663,284.726,2011-01-24,2011,1,24,10
"24/01/2011 11:00",12.22,8.046627998,-1.85427618,0.004994459,102913.3281,278.8605957,8.257515504,282.976,2011-01-24,2011,1,24,11
"24/01/2011 12:00",10.95,8.419428825,-1.708814144,0.005139318,102802.4219,279.5278931,8.591090008,281.472,2011-01-24,2011,1,24,12
"24/01/2011 13:00",11.12,8.796012878,-1.566249013,0.005207731,102685.1719,279.7290344,8.934370629,280.096,2011-01-24,2011,1,24,13
"24/01/2011 14:00",11.86,9.263608933,-1.507694244,0.005276093,102569.125,279.8401489,9.385499048,279.244,2011-01-24,2011,1,24,14
"24/01/2011 15:00",12.24,9.812916756,-1.793967485,0.005322008,102477.1875,279.9023743,9.975552846,280.36,2011-01-24,2011,1,24,15
"24/01/2011 16:00",13.61,10.32032967,-2.353592157,0.005345462,102421.8516,279.736908,10.58530115,282.846,2011-01-24,2011,1,24,16
"24/01/2011 17:00",14.31,10.33446217,-3.052105904,0.005391974,102367.6406,279.5705261,10.77573472,286.453,2011-01-24,2011,1,24,17
"24/01/2011 18:00",12.79,9.946465492,-3.64939189,0.005476634,102323.1719,279.6071472,10.59482123,290.148,2011-01-24,2011,1,24,18
"24/01/2011 19:00",12.31,9.383886337,-3.896935701,0.005569381,102283.25,279.739502,10.16087745,292.552,2011-01-24,2011,1,24,19
"24/01/2011 20:00",12.69,8.823864937,-4.084208012,0.005653133,102244.4063,279.8558655,9.723237501,294.837,2011-01-24,2011,1,24,20
"24/01/2011 21:00",12,8.269126892,-4.140760899,0.005683534,102193,279.8863831,9.247938169,296.599,2011-01-24,2011,1,24,21
"24/01/2011 22:00",12.62,7.930666924,-4.129613876,0.00567597,102141.1094,279.8398132,8.941431016,297.506,2011-01-24,2011,1,24,22
"24/01/2011 23:00",12.23,7.705523968,-4.168221474,0.005637885,102090.8438,279.6116333,8.760660356,298.41,2011-01-24,2011,1,24,23
"25/01/2011 00:00",12.37,7.521354675,-4.264238358,0.00556913,102036.5625,279.297821,8.646068755,299.551,2011-01-25,2011,1,25,0
"25/01/2011 01:00",10.87,7.348183632,-4.116843224,0.005485214,101971.3828,279.1184692,8.42283805,299.259,2011-01-25,2011,1,25,1
"25/01/2011 02:00",10.2,7.304283619,-3.880309105,0.005401348,101908.3047,278.9877319,8.270994979,297.978,2011-01-25,2011,1,25,2
"25/01/2011 03:00",9.73,7.179502487,-3.723847628,0.005348024,101842.0781,278.9118042,8.087786911,297.414,2011-01-25,2011,1,25,3
"25/01/2011 04:00",10.1,6.845510483,-3.723329782,0.005310026,101785.3281,278.8982239,7.792573287,298.542,2011-01-25,2011,1,25,4
"25/01/2011 05:00",9.64,6.27685976,-3.671304703,0.005310098,101739.2734,278.8904419,7.271688021,300.323,2011-01-25,2011,1,25,5
"25/01/2011 06:00",9.08,5.649331093,-3.424300432,0.005341242,101687.2813,278.9793701,6.606116503,301.221,2011-01-25,2011,1,25,6
"25/01/2011 07:00",9.31,5.132553101,-3.099261761,0.00538748,101618.3281,279.0100098,5.995708865,301.125,2011-01-25,2011,1,25,7
"25/01/2011 08:00",8.73,4.786897182,-2.787798405,0.005441082,101549.8438,278.9804688,5.539513027,300.215,2011-01-25,2011,1,25,8
"25/01/2011 09:00",7.86,4.53660059,-2.615969181,0.005524649,101507.9219,278.8942261,5.236796699,299.969,2011-01-25,2011,1,25,9
"25/01/2011 10:00",7.75,4.337956905,-2.507905006,0.005545516,101445.875,278.9433594,5.010734241,300.033,2011-01-25,2011,1,25,10
"25/01/2011 11:00",7.11,4.303467751,-2.520363092,0.005626916,101376.3906,279.2442932,4.98719007,300.355,2011-01-25,2011,1,25,11
"25/01/2011 12:00",6.69,4.447280407,-2.801959276,0.005754257,101278.5,279.7094116,5.256356039,302.212,2011-01-25,2011,1,25,12
"25/01/2011 13:00",7.16,4.744176388,-3.469367743,0.005819813,101199.0156,280.24646,5.877390759,306.177,2011-01-25,2011,1,25,13
"25/01/2011 14:00",8.86,4.838350773,-4.602169514,0.005763295,101173.3438,280.5761108,6.677544641,313.566,2011-01-25,2011,1,25,14
"25/01/2011 15:00",8.3,4.478408813,-5.591209412,0.005563532,101178.8516,280.4446106,7.163642103,321.306,2011-01-25,2011,1,25,15
"25/01/2011 16:00",7.85,4.023758888,-5.600035667,0.005395286,101172.0781,279.9932861,6.895725855,324.301,2011-01-25,2011,1,25,16
"25/01/2011 17:00",7.1,3.856556892,-5.108726978,0.005379521,101166.5,279.8278503,6.400946993,322.95,2011-01-25,2011,1,25,17
"25/01/2011 18:00",7.55,3.960123539,-4.627374649,0.0053871,101147,279.7272949,6.090580809,319.442,2011-01-25,2011,1,25,18
"25/01/2011 19:00",6.68,4.138275146,-4.881052494,0.005379949,101147.7188,279.5438538,6.399218283,319.707,2011-01-25,2011,1,25,19
"25/01/2011 20:00",5.58,3.891266584,-6.012159824,0.005350668,101171.2344,279.2877808,7.161565568,327.087,2011-01-25,2011,1,25,20
"25/01/2011 21:00",7.62,3.316861629,-7.341065884,0.005251097,101220.9531,278.9778442,8.055607946,335.685,2011-01-25,2011,1,25,21
"25/01/2011 22:00",7.73,2.383910656,-8.50514698,0.005113113,101247.2969,278.6948853,8.832924497,344.342,2011-01-25,2011,1,25,22
"25/01/2011 23:00",9.92,1.358647466,-9.288106918,0.004974957,101260.1406,278.452179,9.386951212,351.677,2011-01-25,2011,1,25,23
"26/01/2011 00:00",13.22,0.539662719,-9.652453423,0.004860581,101277.2344,278.2536011,9.667527757,356.799,2011-01-26,2011,1,26,0
"26/01/2011 01:00",12.81,0.07319653,-9.795642853,0.004754351,101297.9531,278.0482483,9.795916324,359.571,2011-01-26,2011,1,26,1
"26/01/2011 02:00",13.12,-0.047209024,-9.792635918,0.004648525,101344.3594,277.8081055,9.792749711,0.276,2011-01-26,2011,1,26,2
"26/01/2011 03:00",13.06,-0.222339511,-10.08754253,0.004514132,101389.1563,277.5437927,10.08999253,1.262,2011-01-26,2011,1,26,3
"26/01/2011 04:00",13.87,-0.564111948,-10.31313133,0.004349515,101444.2031,277.3051758,10.32854782,3.13,2011-01-26,2011,1,26,4
"26/01/2011 05:00",13.59,-0.99506712,-10.27787781,0.004215972,101500.0156,277.1603394,10.32593486,5.529,2011-01-26,2011,1,26,5
"26/01/2011 06:00",13.75,-1.463759542,-10.13259125,0.004122464,101550.9375,277.1110229,10.23777307,8.22,2011-01-26,2011,1,26,6
"26/01/2011 07:00",13.62,-1.803724527,-9.865077972,0.00408432,101607.6719,277.067627,10.02861833,10.361,2011-01-26,2011,1,26,7
"26/01/2011 08:00",12.54,-1.958960176,-9.614209175,0.004107388,101672.2969,277.1016846,9.811755349,11.516,2011-01-26,2011,1,26,8
"26/01/2011 09:00",11.07,-2.042788982,-9.39968586,0.004191119,101738.0781,277.3882141,9.619099806,12.261,2011-01-26,2011,1,26,9
"26/01/2011 10:00",11.69,-2.207889318,-9.371073723,0.004305538,101801.4375,277.7694397,9.627657969,13.257,2011-01-26,2011,1,26,10
"26/01/2011 11:00",11.84,-2.402427197,-9.169416428,0.004426528,101824.7109,278.1730042,9.478916291,14.681,2011-01-26,2011,1,26,11
"26/01/2011 12:00",10.35,-2.514294863,-8.842084885,0.004474522,101825.2266,278.5135498,9.192613544,15.873,2011-01-26,2011,1,26,12
"26/01/2011 13:00",10.27,-2.644497871,-8.740528107,0.004600926,101848.5156,278.7640076,9.131823508,16.833,2011-01-26,2011,1,26,13
"26/01/2011 14:00",10.86,-2.912493229,-8.534787178,0.00487999,101869.8984,278.8626404,9.018049067,18.842,2011-01-26,2011,1,26,14
"26/01/2011 15:00",10.38,-3.318735838,-7.971509457,0.004747887,101884.2969,278.7893066,8.634753649,22.603,2011-01-26,2011,1,26,15
"26/01/2011 16:00",10.68,-3.795032501,-7.566007137,0.00480248,101919.25,278.7220459,8.464439479,26.637,2011-01-26,2011,1,26,16
"26/01/2011 17:00",9.98,-4.259471893,-7.169557571,0.004893959,101978.6719,278.8443604,8.33940385,30.714,2011-01-26,2011,1,26,17
"26/01/2011 18:00",10.57,-4.761059284,-6.601634026,0.004993066,102052.0156,278.9644165,8.139364675,35.798,2011-01-26,2011,1,26,18
"26/01/2011 19:00",10.52,-5.127626419,-5.836270332,0.005183279,102129.4375,278.9692383,7.768822568,41.301,2011-01-26,2011,1,26,19
"26/01/2011 20:00",7.48,-5.473087788,-4.905179977,0.005182732,102197.4375,278.8938293,7.34952247,48.132,2011-01-26,2011,1,26,20
"26/01/2011 21:00",6.75,-5.546944141,-3.824751139,0.005106335,102255.1094,278.7064819,6.737752636,55.412,2011-01-26,2011,1,26,21
"26/01/2011 22:00",5.94,-5.262799263,-2.720529079,0.004885358,102291.75,278.5847168,5.924384741,62.663,2011-01-26,2011,1,26,22
"26/01/2011 23:00",4.82,-4.920972824,-1.767489195,0.004870129,102325.0547,278.4546204,5.228765781,70.242,2011-01-26,2011,1,26,23
"27/01/2011 00:00",4.41,-4.471827984,-1.116303802,0.0048093,102357.3984,278.3909302,4.6090541,75.983,2011-01-27,2011,1,27,0
"27/01/2011 01:00",4.31,-4.07088995,-0.86870867,0.004595282,102385.75,278.3778992,4.162547265,77.954,2011-01-27,2011,1,27,1
"27/01/2011 02:00",4.44,-3.795496941,-0.835223973,0.004457663,102418,278.3322754,3.886308803,77.589,2011-01-27,2011,1,27,2
"27/01/2011 03:00",4.65,-3.543694735,-0.872154474,0.004373342,102459.7656,278.2927551,3.649441848,76.173,2011-01-27,2011,1,27,3
"27/01/2011 04:00",3.52,-3.29592514,-1.001207352,0.004319369,102495.7578,278.2493896,3.444639124,73.102,2011-01-27,2011,1,27,4
"27/01/2011 05:00",4.03,-3.202070236,-1.155956149,0.004280613,102531.3906,278.1981812,3.40433377,70.15,2011-01-27,2011,1,27,5
"27/01/2011 06:00",2.76,-3.216882467,-1.168789625,0.004242063,102573.9688,278.1631165,3.422630859,70.032,2011-01-27,2011,1,27,6
"27/01/2011 07:00",1.78,-3.173220158,-1.003189564,0.004211764,102614.6719,278.1654053,3.328019752,72.456,2011-01-27,2011,1,27,7
"27/01/2011 08:00",2.08,-2.980445147,-0.716553986,0.004188709,102646.5469,278.206543,3.065371574,76.481,2011-01-27,2011,1,27,8
"27/01/2011 09:00",1.98,-2.6348629,-0.285410404,0.004142701,102674.7969,278.2231445,2.650275759,83.817,2011-01-27,2011,1,27,9
"27/01/2011 10:00",3.08,-2.225771904,0.175339103,0.004057242,102712.1641,278.1481934,2.232667546,94.504,2011-01-27,2011,1,27,10
"27/01/2011 11:00",2.34,-1.781671882,0.46642524,0.003933844,102714.9219,278.0367126,1.841713115,104.67,2011-01-27,2011,1,27,11
"27/01/2011 12:00",2.32,-1.371676564,0.665187001,0.003924967,102694.2656,278.0753784,1.524457393,115.87,2011-01-27,2011,1,27,12
"27/01/2011 13:00",1.53,-0.929118156,0.841629326,0.003924075,102687.6563,278.0531006,1.253634904,132.171,2011-01-27,2011,1,27,13
"27/01/2011 14:00",1.01,-0.327440262,0.882462025,0.004000078,102700.3984,278.0822144,0.941252543,159.642,2011-01-27,2011,1,27,14
"27/01/2011 15:00",1.32,0.417690396,0.408522844,0.004122449,102694.3047,278.3699951,0.584256948,225.635,2011-01-27,2011,1,27,15
"27/01/2011 16:00",1.67,0.93244195,-0.4458296,0.004092469,102716.0781,278.3815918,1.03354343,295.553,2011-01-27,2011,1,27,16
"27/01/2011 17:00",1.54,1.050490022,-1.27645874,0.004077591,102753.2891,278.3690186,1.653141313,320.546,2011-01-27,2011,1,27,17
"27/01/2011 18:00",1.7,0.88787663,-1.834361434,0.004062104,102782.3438,278.3251343,2.0379418,334.171,2011-01-27,2011,1,27,18
"27/01/2011 19:00",1.36,0.613184333,-2.149595976,0.00404641,102782.3359,278.2490845,2.235342901,344.078,2011-01-27,2011,1,27,19
"27/01/2011 20:00",1.24,0.269718409,-2.251399279,0.004023225,102781.7031,278.1865845,2.267497901,353.168,2011-01-27,2011,1,27,20
"27/01/2011 21:00",1.4,-0.152931213,-2.101082325,0.003993051,102795.8281,278.1185303,2.106640665,4.163,2011-01-27,2011,1,27,21
"27/01/2011 22:00",1.15,-0.476787567,-1.746757269,0.003964768,102793.2188,278.0402832,1.810659366,15.267,2011-01-27,2011,1,27,22
"27/01/2011 23:00",1.14,-0.596881986,-1.2315979,0.003943659,102790.7813,277.9715271,1.368612981,25.856,2011-01-27,2011,1,27,23
"28/01/2011 00:00",1.08,-0.544631362,-0.693041682,0.003928883,102782.0938,277.9025879,0.881436381,38.162,2011-01-28,2011,1,28,0
"28/01/2011 01:00",0.74,-0.344249249,-0.157527059,0.00391362,102782.1797,277.8366089,0.378579344,65.411,2011-01-28,2011,1,28,1
"28/01/2011 02:00",1.76,0.042828441,0.376085818,0.0038977,102787.9922,277.7740479,0.378516602,186.496,2011-01-28,2011,1,28,2
"28/01/2011 03:00",2.89,0.506252408,0.727992415,0.003897644,102770.5156,277.6571045,0.886715545,214.815,2011-01-28,2011,1,28,3
"28/01/2011 04:00",3.4,1.050519705,0.895245671,0.003897297,102752,277.4779053,1.380237828,229.562,2011-01-28,2011,1,28,4
"28/01/2011 05:00",4.03,1.592701316,0.946279407,0.003885533,102731.2813,277.2764282,1.852604166,239.283,2011-01-28,2011,1,28,5
"28/01/2011 06:00",3.18,2.064390183,0.909845293,0.003870054,102727,277.0791931,2.255997625,246.215,2011-01-28,2011,1,28,6
"28/01/2011 07:00",2.17,2.36650753,0.76755631,0.003842916,102736.2188,276.8911133,2.487870692,252.029,2011-01-28,2011,1,28,7
"28/01/2011 08:00",2.03,2.451837778,0.56048286,0.003812479,102750.6094,276.7319031,2.515084397,257.123,2011-01-28,2011,1,28,8
"28/01/2011 09:00",3.07,2.498065472,0.341128021,0.00375935,102763.0547,276.6452332,2.521249577,262.223,2011-01-28,2011,1,28,9
"28/01/2011 10:00",2.92,2.401619196,0.427200913,0.003541856,102758.3125,276.3493042,2.439318631,259.913,2011-01-28,2011,1,28,10
"28/01/2011 11:00",2.84,2.294318199,0.591538787,0.003446709,102730.1797,276.2563477,2.369348884,255.542,2011-01-28,2011,1,28,11
"28/01/2011 12:00",2.37,2.302516222,0.672676742,0.003476758,102682.875,276.3483582,2.398765297,253.714,2011-01-28,2011,1,28,12
"28/01/2011 13:00",2.25,2.363402367,0.632487059,0.003502474,102643.1094,276.3387146,2.446571198,255.017,2011-01-28,2011,1,28,13
"28/01/2011 14:00",3.36,2.505381823,0.629142523,0.003589604,102608.4219,276.5171509,2.583168285,255.903,2011-01-28,2011,1,28,14
"28/01/2011 15:00",3.81,2.624304295,0.685116649,0.003661999,102571.1953,276.7984009,2.712260654,255.368,2011-01-28,2011,1,28,15
"28/01/2011 16:00",3.74,2.674306631,0.692209601,0.003635514,102563.2344,276.8617554,2.762439156,255.488,2011-01-28,2011,1,28,16
"28/01/2011 17:00",3.44,2.817094803,0.637859702,0.00356699,102568.75,276.7736816,2.888405811,257.241,2011-01-28,2011,1,28,17
"28/01/2011 18:00",3.05,3.125975847,0.543264151,0.003494787,102584.6875,276.6219482,3.17283169,260.141,2011-01-28,2011,1,28,18
"28/01/2011 19:00",2.63,3.525891066,0.373571754,0.003418307,102585.3594,276.4205322,3.54562599,263.952,2011-01-28,2011,1,28,19
"28/01/2011 20:00",3.79,3.834061146,0.208014876,0.003341547,102587.5938,276.2008667,3.839699866,266.894,2011-01-28,2011,1,28,20
"28/01/2011 21:00",4.58,4.04834938,0.11594864,0.0033034,102574.6563,276.1037598,4.050009481,268.359,2011-01-28,2011,1,28,21
"28/01/2011 22:00",4.22,4.259609222,-0.071121268,0.003288716,102559.2266,276.0886841,4.260202925,270.956,2011-01-28,2011,1,28,22
"28/01/2011 23:00",4.57,4.38340807,-0.409145415,0.003327979,102542.875,276.1473389,4.402461388,275.332,2011-01-28,2011,1,28,23
"29/01/2011 00:00",4.18,4.337839603,-0.653045654,0.003389702,102508.3125,276.1971436,4.386720991,278.561,2011-01-29,2011,1,29,0
"29/01/2011 01:00",4.26,4.214317322,-0.704289198,0.003455167,102478.375,276.2374268,4.272761843,279.487,2011-01-29,2011,1,29,1
"29/01/2011 02:00",4.05,4.153575897,-0.714140773,0.003505657,102446.6016,276.2767944,4.214521299,279.755,2011-01-29,2011,1,29,2
"29/01/2011 03:00",3.9,4.239754677,-0.795203269,0.003541396,102428.9609,276.1810303,4.313683804,280.622,2011-01-29,2011,1,29,3
"29/01/2011 04:00",4.45,4.300327778,-1.035801649,0.003577531,102437.3047,276.0653687,4.423313696,283.542,2011-01-29,2011,1,29,4
"29/01/2011 05:00",3.73,4.130204678,-1.377335548,0.003635257,102456.2969,276.0013123,4.353807976,288.442,2011-01-29,2011,1,29,5
"29/01/2011 06:00",4.76,3.642264843,-1.88228941,0.003714575,102483.5625,276.0652771,4.099891048,297.329,2011-01-29,2011,1,29,6
"29/01/2011 07:00",2.43,2.787242651,-2.390976191,0.003836632,102504.5469,276.2309265,3.672259351,310.623,2011-01-29,2011,1,29,7
"29/01/2011 08:00",3.37,1.559470654,-2.776707649,0.003998196,102536.0313,276.4465637,3.184659179,330.68,2011-01-29,2011,1,29,8
"29/01/2011 09:00",3.86,0.370086551,-2.990865946,0.00414121,102568.0156,276.6353455,3.013676021,352.946,2011-01-29,2011,1,29,9
"29/01/2011 10:00",4.67,-0.527690291,-2.98688364,0.004200842,102600.2813,276.7107239,3.033138791,10.019,2011-01-29,2011,1,29,10
"29/01/2011 11:00",4.08,-1.174808741,-2.891821861,0.004345635,102591.2031,277.078186,3.121347346,22.109,2011-01-29,2011,1,29,11
"29/01/2011 12:00",3.91,-1.625902414,-2.877316952,0.004483325,102548.25,277.5809937,3.304922314,29.469,2011-01-29,2011,1,29,12
"29/01/2011 13:00",3.7,-1.845264316,-2.789251089,0.004553039,102529.9922,277.8240967,3.344386645,33.487,2011-01-29,2011,1,29,13
"29/01/2011 14:00",3.64,-1.948055625,-2.709897518,0.004638447,102534.0781,278.0061035,3.337433936,35.711,2011-01-29,2011,1,29,14
"29/01/2011 15:00",3.37,-2.384188652,-2.599255562,0.004723992,102519.0781,278.3097229,3.527107172,42.528,2011-01-29,2011,1,29,15
"29/01/2011 16:00",3.14,-2.959270239,-2.164243937,0.004731477,102532.1406,278.514679,3.666228602,53.82,2011-01-29,2011,1,29,16
"29/01/2011 17:00",3.53,-3.336421013,-1.480888009,0.004708512,102579.1719,278.6835022,3.650306079,66.065,2011-01-29,2011,1,29,17
"29/01/2011 18:00",3.89,-3.482029438,-0.650235772,0.004678252,102628.3125,278.8351135,3.54222184,79.422,2011-01-29,2011,1,29,18
"29/01/2011 19:00",3.86,-3.499326468,0.223239064,0.004648029,102652.3203,278.9168701,3.50643999,93.65,2011-01-29,2011,1,29,19
"29/01/2011 20:00",3.71,-3.478754044,1.000758886,0.004602976,102669.4141,278.9682617,3.619840887,106.049,2011-01-29,2011,1,29,20
"29/01/2011 21:00",3.6,-3.233293295,1.763510823,0.004434924,102670.0625,278.946228,3.682954786,118.609,2011-01-29,2011,1,29,21
"29/01/2011 22:00",2.91,-2.480249405,2.36705637,0.004333652,102650.0313,278.7910767,3.428497188,133.662,2011-01-29,2011,1,29,22
"29/01/2011 23:00",2.88,-1.537351489,2.62793684,0.004333787,102616.6875,278.6116638,3.044585626,149.672,2011-01-29,2011,1,29,23
"30/01/2011 00:00",2.4,-0.780192494,2.77235651,0.004327027,102565.9531,278.3971558,2.880045303,164.282,2011-01-30,2011,1,30,0
"30/01/2011 01:00",NA,-0.198972464,3.101592541,0.0042736,102508.875,278.1378784,3.1079682,176.329,2011-01-30,2011,1,30,1
"30/01/2011 02:00",NA,0.655155182,3.501759052,0.004341918,102448.2031,277.5952148,3.562519442,190.597,2011-01-30,2011,1,30,2
"30/01/2011 03:00",NA,1.19941771,3.709457159,0.004402677,102400.7344,277.2493896,3.89854784,197.918,2011-01-30,2011,1,30,3
"30/01/2011 04:00",NA,1.593847036,3.885735035,0.004410009,102371.0938,276.9782104,4.199914896,202.302,2011-01-30,2011,1,30,4
"30/01/2011 05:00",NA,2.039189577,3.914380312,0.004409816,102365.1406,276.4794312,4.4136909,207.517,2011-01-30,2011,1,30,5
"30/01/2011 06:00",4.55,2.538453341,3.922772646,0.004386766,102369.5781,275.8460693,4.672460871,212.907,2011-01-30,2011,1,30,6
"30/01/2011 07:00",4.65,2.967043638,3.949988604,0.004325586,102364.9063,275.29245,4.940218408,216.912,2011-01-30,2011,1,30,7
"30/01/2011 08:00",5.19,3.24650383,3.967818737,0.004195789,102352.6953,274.9548035,5.126731185,219.29,2011-01-30,2011,1,30,8
"30/01/2011 09:00",5.47,3.5206213,4.150300503,0.004020257,102334.6797,274.6834106,5.442404671,220.307,2011-01-30,2011,1,30,9
"30/01/2011 10:00",6.43,4.117665768,4.549523354,0.003943875,102303.5469,275.1143188,6.136231263,222.147,2011-01-30,2011,1,30,10
"30/01/2011 11:00",6.98,5.129090786,5.221391678,0.003664992,102244.4219,275.7596436,7.319187342,224.489,2011-01-30,2011,1,30,11
"30/01/2011 12:00",7.97,6.097297192,5.603060722,0.003331535,102180.9141,275.9417419,8.280780308,227.418,2011-01-30,2011,1,30,12
"30/01/2011 13:00",8.51,6.878699303,5.339806557,0.003173476,102143.9219,275.9020386,8.708044451,232.178,2011-01-30,2011,1,30,13
"30/01/2011 14:00",7.44,7.26285553,4.843839169,0.003126224,102119.4688,275.7471313,8.729939767,236.299,2011-01-30,2011,1,30,14
"30/01/2011 15:00",7.22,6.942667961,4.589611053,0.003252005,102085.2734,275.3486938,8.322569798,236.532,2011-01-30,2011,1,30,15
"30/01/2011 16:00",8.49,6.792300701,4.797322273,0.003424459,102079.5625,274.9101563,8.315626844,234.766,2011-01-30,2011,1,30,16
"30/01/2011 17:00",8.27,6.944325924,4.924580097,0.003540006,102088.3672,274.5473022,8.513233914,234.657,2011-01-30,2011,1,30,17
"30/01/2011 18:00",6.89,7.062876701,4.806282043,0.003571823,102093.8594,274.3323669,8.543100981,235.764,2011-01-30,2011,1,30,18
"30/01/2011 19:00",6.21,7.146684647,4.791241646,0.003580267,102078.6875,274.2208557,8.604132609,236.161,2011-01-30,2011,1,30,19
"30/01/2011 20:00",5.97,7.378623009,4.796336651,0.00359554,102073.4844,274.1733704,8.800506961,236.974,2011-01-30,2011,1,30,20
"30/01/2011 21:00",7.32,7.906765938,4.61691761,0.003629834,102095.8125,274.2590637,9.156029479,239.718,2011-01-30,2011,1,30,21
"30/01/2011 22:00",6.89,8.251024246,4.398492336,0.003709974,102080.4141,274.4771423,9.350194433,241.938,2011-01-30,2011,1,30,22
"30/01/2011 23:00",8.43,8.269051552,4.232273102,0.003820884,102056.2188,274.8100586,9.289206057,242.895,2011-01-30,2011,1,30,23
"31/01/2011 00:00",8.64,8.265660286,4.074026108,0.003951191,102028.0781,275.2136841,9.215141273,243.761,2011-01-31,2011,1,31,0
"31/01/2011 01:00",8.32,8.133393288,3.921523333,0.004104638,102005.4844,275.701355,9.029420337,244.258,2011-01-31,2011,1,31,1
"31/01/2011 02:00",8.28,7.866449356,3.913671732,0.004265043,101975.8594,276.1404724,8.786230813,243.548,2011-01-31,2011,1,31,2
"31/01/2011 03:00",6.9,7.631971836,4.115008354,0.004379739,101951.625,276.4295349,8.670656715,241.667,2011-01-31,2011,1,31,3
"31/01/2011 04:00",7.11,7.47774601,4.476260185,0.004448888,101929.1328,276.6106262,8.715135721,239.094,2011-01-31,2011,1,31,4
"31/01/2011 05:00",7.83,7.519032002,4.781804562,0.004517091,101920.6875,276.7887268,8.91075177,237.545,2011-01-31,2011,1,31,5
"31/01/2011 06:00",7.52,7.681618214,4.971749783,0.004569754,101937.4063,276.9188843,9.150166899,237.087,2011-01-31,2011,1,31,6
"31/01/2011 07:00",8.67,7.747746944,5.272485256,0.004607585,101958.5156,276.8745117,9.371589166,235.763,2011-01-31,2011,1,31,7
"31/01/2011 08:00",8.95,7.645598412,5.760853767,0.004622855,101966.5625,276.8786011,9.573014739,233.002,2011-01-31,2011,1,31,8
"31/01/2011 09:00",8.47,7.426183701,6.401075363,0.00466917,101958.75,277.3126221,9.804181259,229.239,2011-01-31,2011,1,31,9
"31/01/2011 10:00",10.41,7.330749035,7.047933102,0.004753628,101950.625,277.9870605,10.16923018,226.126,2011-01-31,2011,1,31,10
"31/01/2011 11:00",10.63,7.445848465,7.7627635,0.004822892,101905.7344,278.4980469,10.75644721,223.806,2011-01-31,2011,1,31,11
"31/01/2011 12:00",11.76,7.719325066,8.451611519,0.004875956,101816.4375,278.7962952,11.44629708,222.407,2011-01-31,2011,1,31,12
"31/01/2011 13:00",11.85,8.057478905,9.033262253,0.004882763,101729.1406,278.9470825,12.10465998,221.732,2011-01-31,2011,1,31,13
"31/01/2011 14:00",12.27,8.293193817,9.558350563,0.00487429,101665.1875,279.0173035,12.65460901,220.946,2011-01-31,2011,1,31,14
"31/01/2011 15:00",12.62,8.375804901,9.993358612,0.004842503,101602.3594,278.8566895,13.03922253,219.967,2011-01-31,2011,1,31,15
"31/01/2011 16:00",11.84,8.374167442,10.29225922,0.004776301,101567.1875,278.4812317,13.26865781,219.133,2011-01-31,2011,1,31,16
"31/01/2011 17:00",12.28,8.390024185,10.54941368,0.004742186,101541.1406,278.2404785,13.4789701,218.495,2011-01-31,2011,1,31,17
"31/01/2011 18:00",13.67,8.441854477,10.77981567,0.00477901,101525.0625,278.2650452,13.69194409,218.065,2011-01-31,2011,1,31,18
"31/01/2011 19:00",14.18,8.614585876,10.98227119,0.004862817,101474.5156,278.4716797,13.95784261,218.11,2011-01-31,2011,1,31,19
"31/01/2011 20:00",15.95,8.813350677,11.15972805,0.004976689,101424.0938,278.6942444,14.22022083,218.299,2011-01-31,2011,1,31,20
"31/01/2011 21:00",15.94,9.053017616,11.34523487,0.005083377,101376.3047,278.9630127,14.51452659,218.588,2011-01-31,2011,1,31,21
"31/01/2011 22:00",15.75,9.473117828,11.31922913,0.005197615,101319.4141,279.2859802,14.76024761,219.926,2011-01-31,2011,1,31,22
"31/01/2011 23:00",15.68,10.1906395,10.82308006,0.00531227,101287.5625,279.6312866,14.86567171,223.276,2011-01-31,2011,1,31,23
"01/02/2011 00:00",16.47,10.70257664,9.7588377,0.005395145,101275.6875,279.8830566,14.4837861,227.64,2011-02-01,2011,2,1,0
"01/02/2011 01:00",14.84,10.7063942,8.414432526,0.005456606,101259.4219,280.0416565,13.61725198,231.835,2011-02-01,2011,2,1,1
"01/02/2011 02:00",15.19,10.48369026,7.067555904,0.005562528,101251.2656,280.1757813,12.64350062,236.014,2011-02-01,2011,2,1,2
"01/02/2011 03:00",11.4,10.43548107,5.724080563,0.005684904,101242.625,280.2889709,11.90228396,241.254,2011-02-01,2011,2,1,3
"01/02/2011 04:00",10.12,10.55847454,4.609116554,0.005707528,101266.0156,280.4176941,11.52064842,246.417,2011-02-01,2011,2,1,4
"01/02/2011 05:00",7.18,10.71944332,3.946948051,0.005555401,101318.3906,280.0147705,11.42299716,249.786,2011-02-01,2011,2,1,5
"01/02/2011 06:00",8.97,10.94205093,3.598096848,0.0052729,101379.3594,279.3321838,11.51845387,251.797,2011-02-01,2011,2,1,6
"01/02/2011 07:00",12.5,11.10312748,3.353219748,0.005090234,101426.7656,278.9373169,11.59842759,253.195,2011-02-01,2011,2,1,7
"01/02/2011 08:00",11.91,11.37069893,2.927028179,0.005006382,101502.0781,278.8722839,11.74139208,255.564,2011-02-01,2011,2,1,8
"01/02/2011 09:00",13.38,11.58718681,2.518839359,0.004969175,101598.7969,279.2817993,11.85780123,257.735,2011-02-01,2011,2,1,9
"01/02/2011 10:00",16.02,11.57055283,2.502311707,0.004939016,101651.8516,279.7831726,11.83804277,257.796,2011-02-01,2011,2,1,10
"01/02/2011 11:00",13.76,11.46793175,3.001731873,0.004924497,101640.7031,280.2104797,11.85427572,255.331,2011-02-01,2011,2,1,11
"01/02/2011 12:00",14.06,11.45976257,3.580393553,0.004994084,101598.6328,280.5516357,12.00605581,252.649,2011-02-01,2011,2,1,12
"01/02/2011 13:00",13.49,11.5541954,3.961786985,0.005185774,101598.1875,280.6638489,12.21454819,251.073,2011-02-01,2011,2,1,13
"01/02/2011 14:00",12.52,11.7874136,4.096010208,0.005110949,101598.1563,280.4109497,12.47879878,250.838,2011-02-01,2011,2,1,14
"01/02/2011 15:00",11.36,11.79924488,4.028671741,0.004774889,101617.2109,279.864563,12.46805421,251.148,2011-02-01,2011,2,1,15
"01/02/2011 16:00",9.8,11.49712658,3.722425461,0.004765867,101677.4609,279.2174377,12.08471642,252.059,2011-02-01,2011,2,1,16
"01/02/2011 17:00",8.55,11.17676735,3.357390404,0.004795398,101734.9141,278.8652649,11.67014133,253.28,2011-02-01,2011,2,1,17
"01/02/2011 18:00",9.01,10.65945148,2.986237526,0.004810432,101789.1563,278.6714478,11.06984736,254.349,2011-02-01,2011,2,1,18
"01/02/2011 19:00",8.35,10.04738045,2.637268305,0.004810226,101838.5,278.5023193,10.38773498,255.292,2011-02-01,2011,2,1,19
"01/02/2011 20:00",8.51,9.052373886,2.908492088,0.004809604,101877.8594,278.309021,9.508143836,252.187,2011-02-01,2011,2,1,20
"01/02/2011 21:00",9.08,8.194217682,3.571567059,0.004794085,101877.0156,278.2972412,8.938752411,246.449,2011-02-01,2011,2,1,21
"01/02/2011 22:00",8.16,7.55873394,4.631875515,0.004779696,101841.125,278.3652954,8.865028458,238.5,2011-02-01,2011,2,1,22
"01/02/2011 23:00",8.21,6.858384132,5.870207787,0.004788842,101772,278.3948975,9.027556279,229.439,2011-02-01,2011,2,1,23
"02/02/2011 00:00",8.39,5.93921423,7.291306019,0.004825439,101650.7422,278.4969788,9.404116605,219.164,2011-02-02,2011,2,2,0
"02/02/2011 01:00",8.56,5.567304611,8.794632912,0.004939738,101532.1563,278.7213745,10.4086718,212.335,2011-02-02,2011,2,2,1
"02/02/2011 02:00",12.84,6.127444744,10.30526543,0.005166756,101379.9531,279.213501,11.9893317,210.735,2011-02-02,2011,2,2,2
"02/02/2011 03:00",13.76,6.953074455,11.90623951,0.005417424,101222.9922,279.9019775,13.78781287,210.284,2011-02-02,2011,2,2,3
"02/02/2011 04:00",16.18,8.014988899,12.96390629,0.005523672,101071.4531,280.4130554,15.24148658,211.726,2011-02-02,2011,2,2,4
"02/02/2011 05:00",16.4,9.511312485,13.10453415,0.005491677,100977.4688,280.68573,16.19240194,215.972,2011-02-02,2011,2,2,5
"02/02/2011 06:00",17.35,10.48199081,12.79558277,0.005513097,100905.8672,280.7921143,16.54083039,219.323,2011-02-02,2011,2,2,6
"02/02/2011 07:00",16.53,10.77162838,12.6113205,0.005626062,100845.5234,280.9276733,16.58533637,220.501,2011-02-02,2011,2,2,7
"02/02/2011 08:00",14.72,10.81143856,12.35303116,0.005777154,100802.625,281.3087769,16.41598558,221.192,2011-02-02,2011,2,2,8
"02/02/2011 09:00",14.2,10.75946331,12.46923256,0.00597486,100756.7656,281.94104,16.46960265,220.79,2011-02-02,2011,2,2,9
"02/02/2011 10:00",16.48,11.0144577,12.25777149,0.006219015,100689.6406,282.7404785,16.47941869,221.941,2011-02-02,2011,2,2,10
"02/02/2011 11:00",19.83,11.62257957,10.93783665,0.006425309,100621.8125,283.0352783,15.9599695,226.738,2011-02-02,2011,2,2,11
"02/02/2011 12:00",17.69,11.99592686,8.487686157,0.006608326,100561.4844,283.2037354,14.69500179,234.718,2011-02-02,2011,2,2,12
"02/02/2011 13:00",19.33,11.68085861,6.592893124,0.006585401,100523.9375,283.5630188,13.4130048,240.558,2011-02-02,2011,2,2,13
"02/02/2011 14:00",16.78,11.11572742,6.289844513,0.006295395,100507.8672,283.0901184,12.77190433,240.496,2011-02-02,2011,2,2,14
"02/02/2011 15:00",14.02,10.97164345,5.829597473,0.006020764,100493.75,282.1078491,12.42421694,242.016,2011-02-02,2011,2,2,15
"02/02/2011 16:00",15.44,11.18992233,4.819651604,0.005791944,100536.2656,281.2328491,12.1837352,246.697,2011-02-02,2011,2,2,16
"02/02/2011 17:00",16.19,10.99596787,4.234073639,0.005708117,100619.0469,280.6789551,11.78298302,248.94,2011-02-02,2011,2,2,17
"02/02/2011 18:00",12.19,10.95545197,3.965857744,0.005548296,100693.9375,280.2236633,11.65117828,250.099,2011-02-02,2011,2,2,18
